url,canonical,title,page_type,indexable,og_image,twitter_image,local_path,img_exists,img_mime,img_w,img_h,img_bytes,og_image_alt,twitter_image_alt,unique_or_shared,is_approved,approved_file,classification,problems
https://ambisecure.ambimat.com/resources/tools/xml-formatter/,https://ambisecure.ambimat.com/resources/tools/xml-formatter/,XML Formatter and Validator — AmbiSecure | pretty-print XML,resource,True,https://ambisecure.ambimat.com/assets/img/og/featured/ambisecure-resources-tools-xml-formatter-1200x630.png,https://ambisecure.ambimat.com/assets/img/og/featured/ambisecure-resources-tools-xml-formatter-1200x630.png,assets/img/og/featured/ambisecure-resources-tools-xml-formatter-1200x630.png,True,image/png,1200,630,51784,"AmbiSecure XML tool concept art: minified markup entering the browser DOMParser, indented output returned, and a DTD external-entity fetch cut off in-browser.","AmbiSecure XML tool concept art: minified markup entering the browser DOMParser, indented output returned, and a DTD external-entity fetch cut off in-browser.",unique,False,,Brand-consistent (generated featured art),
https://ambisecure.ambimat.com/resources/webauthn/,https://ambisecure.ambimat.com/resources/webauthn/,WebAuthn Reference — AmbiSecure | Developer documentation portal,resource,True,https://ambisecure.ambimat.com/assets/img/og/featured/ambisecure-resources-webauthn-1200x630.png,https://ambisecure.ambimat.com/assets/img/og/featured/ambisecure-resources-webauthn-1200x630.png,assets/img/og/featured/ambisecure-resources-webauthn-1200x630.png,True,image/png,1200,630,47593,"Annotated authenticatorData layout beside the relying-party checks — rpIdHash, flags, attestation — from the AmbiSecure WebAuthn engineering reference portal.","Annotated authenticatorData layout beside the relying-party checks — rpIdHash, flags, attestation — from the AmbiSecure WebAuthn engineering reference portal.",unique,False,,Brand-consistent (generated featured art),
https://ambisecure.ambimat.com/search/,https://ambisecure.ambimat.com/search/,"Search AmbiSecure &mdash; products, services, technologies, blog",utility,True,https://ambisecure.ambimat.com/assets/img/og/search.png,https://ambisecure.ambimat.com/assets/img/og/search.png,assets/img/og/search.png,True,image/png,1200,630,369444,AmbiSecure search title card: client-side search across every modern post and the historical archive.,AmbiSecure search title card: client-side search across every modern post and the historical archive.,unique,False,,Utility/category (documented),
https://ambisecure.ambimat.com/services/epassport-platform/,https://ambisecure.ambimat.com/services/epassport-platform/,AmbiSecure ePassport Platform Engineering &mdash; Backend + PKI,service,True,https://ambisecure.ambimat.com/assets/img/og/featured/ambisecure-services-epassport-platform-1200x630.png,https://ambisecure.ambimat.com/assets/img/og/featured/ambisecure-services-epassport-platform-1200x630.png,assets/img/og/featured/ambisecure-services-epassport-platform-1200x630.png,True,image/png,1200,630,90049,"AmbiSecure ePassport platform engineering — an ICAO 9303 pipeline spanning enrolment, personalisation and CSCA/DSC PKI.","AmbiSecure ePassport platform engineering — an ICAO 9303 pipeline spanning enrolment, personalisation and CSCA/DSC PKI.",unique,True,ambisecure-services-epassport-platform-1200x630.png,Approved reference image,
https://ambisecure.ambimat.com/services/fido-validation-server/demo/,https://ambisecure.ambimat.com/services/fido-validation-server/demo/,FIDO Validation Server demo &mdash; access posture &mdash; AmbiSecure,service,True,https://ambisecure.ambimat.com/assets/img/og/featured/ambisecure-services-fido-validation-server-demo-1200x630.png,https://ambisecure.ambimat.com/assets/img/og/featured/ambisecure-services-fido-validation-server-demo-1200x630.png,assets/img/og/featured/ambisecure-services-fido-validation-server-demo-1200x630.png,True,image/png,1200,630,44744,Flow diagram showing a validation request sent to the FIDO validation server and returned with a validation result.,Flow diagram showing a validation request sent to the FIDO validation server and returned with a validation result.,unique,False,,Brand-consistent (generated featured art),
https://ambisecure.ambimat.com/services/fido-validation-server/,https://ambisecure.ambimat.com/services/fido-validation-server/,AmbiSecure FIDO Validation Server &mdash; Multi-tenant FIDO2 SaaS,service,True,https://ambisecure.ambimat.com/assets/img/og/featured/ambisecure-services-fido-validation-server-1200x630.png,https://ambisecure.ambimat.com/assets/img/og/featured/ambisecure-services-fido-validation-server-1200x630.png,assets/img/og/featured/ambisecure-services-fido-validation-server-1200x630.png,True,image/png,1200,630,91350,"AmbiSecure validation server handling attestation, tenant policy and metadata to approve FIDO2 authentication.","AmbiSecure validation server handling attestation, tenant policy and metadata to approve FIDO2 authentication.",unique,True,ambisecure-services-fido-validation-server-1200x630.png,Approved reference image,
https://ambisecure.ambimat.com/services/,https://ambisecure.ambimat.com/services/,"Services &mdash; AmbiSecure | JavaCard, FIDO server, personalisation tooling",service-index,True,https://ambisecure.ambimat.com/assets/img/og/featured/ambisecure-services-1200x630.png,https://ambisecure.ambimat.com/assets/img/og/featured/ambisecure-services-1200x630.png,assets/img/og/featured/ambisecure-services-1200x630.png,True,image/png,1200,630,87055,"AmbiSecure engineering lifecycle from secure silicon through applet development, loading, personalization, form factor and backend validation.","AmbiSecure engineering lifecycle from secure silicon through applet development, loading, personalization, form factor and backend validation.",unique,True,ambisecure-services-1200x630.png,Approved reference image,
https://ambisecure.ambimat.com/services/javacard-development/,https://ambisecure.ambimat.com/services/javacard-development/,JavaCard Applet Development — full-cycle JCOP | AmbiSecure,service,True,https://ambisecure.ambimat.com/assets/img/og/featured/ambisecure-services-javacard-development-1200x630.png,https://ambisecure.ambimat.com/assets/img/og/featured/ambisecure-services-javacard-development-1200x630.png,assets/img/og/featured/ambisecure-services-javacard-development-1200x630.png,True,image/png,1200,630,38516,"Lifecycle diagram for JavaCard Applet Development, following discover to design through ordered stages.","Lifecycle diagram for JavaCard Applet Development, following discover to design through ordered stages.",unique,False,,Brand-consistent (generated featured art),
https://ambisecure.ambimat.com/services/tool-chain-development/bio-enrollment-app/,https://ambisecure.ambimat.com/services/tool-chain-development/bio-enrollment-app/,Bio Enrollment App — match-on-card biometrics | AmbiSecure,service,True,https://ambisecure.ambimat.com/assets/img/og/featured/ambisecure-services-tool-chain-development-bio-enrollment-app-1200x630.png,https://ambisecure.ambimat.com/assets/img/og/featured/ambisecure-services-tool-chain-development-bio-enrollment-app-1200x630.png,assets/img/og/featured/ambisecure-services-tool-chain-development-bio-enrollment-app-1200x630.png,True,image/png,1200,630,33544,"Lifecycle diagram for Bio Enrollment App, following capture to quality through ordered stages.","Lifecycle diagram for Bio Enrollment App, following capture to quality through ordered stages.",unique,False,,Brand-consistent (generated featured art),
https://ambisecure.ambimat.com/services/tool-chain-development/,https://ambisecure.ambimat.com/services/tool-chain-development/,"Tool-Chain Development — bio, key manager, loader | AmbiSecure",service,True,https://ambisecure.ambimat.com/assets/img/og/featured/ambisecure-services-tool-chain-development-1200x630.png,https://ambisecure.ambimat.com/assets/img/og/featured/ambisecure-services-tool-chain-development-1200x630.png,assets/img/og/featured/ambisecure-services-tool-chain-development-1200x630.png,True,image/png,1200,630,38123,"Lifecycle diagram for Tool-Chain Development, following CAP load to NDEF perso through ordered stages.","Lifecycle diagram for Tool-Chain Development, following CAP load to NDEF perso through ordered stages.",unique,False,,Brand-consistent (generated featured art),
https://ambisecure.ambimat.com/services/tool-chain-development/multi-card-applet-loader/,https://ambisecure.ambimat.com/services/tool-chain-development/multi-card-applet-loader/,Multi-Card Applet Loader — SCP03 CAP loader | AmbiSecure,service,True,https://ambisecure.ambimat.com/assets/img/og/featured/ambisecure-services-tool-chain-development-multi-card-applet-loader-1200x630.png,https://ambisecure.ambimat.com/assets/img/og/featured/ambisecure-services-tool-chain-development-multi-card-applet-loader-1200x630.png,assets/img/og/featured/ambisecure-services-tool-chain-development-multi-card-applet-loader-1200x630.png,True,image/png,1200,630,41865,"Lifecycle diagram for Multi-Card Applet Loader, following SCP03 open to LOAD CAP through ordered stages.","Lifecycle diagram for Multi-Card Applet Loader, following SCP03 open to LOAD CAP through ordered stages.",unique,False,,Brand-consistent (generated featured art),
https://ambisecure.ambimat.com/services/tool-chain-development/ndef-personalisation/,https://ambisecure.ambimat.com/services/tool-chain-development/ndef-personalisation/,NDEF Personalisation Tool — NFC Forum NDEF | AmbiSecure,service,True,https://ambisecure.ambimat.com/assets/img/og/featured/ambisecure-services-tool-chain-development-ndef-personalisation-1200x630.png,https://ambisecure.ambimat.com/assets/img/og/featured/ambisecure-services-tool-chain-development-ndef-personalisation-1200x630.png,assets/img/og/featured/ambisecure-services-tool-chain-development-ndef-personalisation-1200x630.png,True,image/png,1200,630,39853,"Lifecycle diagram for NDEF Personalisation Tool, following CSV payload to write NDEF through ordered stages.","Lifecycle diagram for NDEF Personalisation Tool, following CSV payload to write NDEF through ordered stages.",unique,False,,Brand-consistent (generated featured art),
https://ambisecure.ambimat.com/services/tool-chain-development/security-key-manager/,https://ambisecure.ambimat.com/services/tool-chain-development/security-key-manager/,Security Key Manager — enterprise key lifecycle | AmbiSecure,service,True,https://ambisecure.ambimat.com/assets/img/og/featured/ambisecure-services-tool-chain-development-security-key-manager-1200x630.png,https://ambisecure.ambimat.com/assets/img/og/featured/ambisecure-services-tool-chain-development-security-key-manager-1200x630.png,assets/img/og/featured/ambisecure-services-tool-chain-development-security-key-manager-1200x630.png,True,image/png,1200,630,38871,"Lifecycle diagram for Security Key Manager, following issued to suspended through ordered stages.","Lifecycle diagram for Security Key Manager, following issued to suspended through ordered stages.",unique,False,,Brand-consistent (generated featured art),
https://ambisecure.ambimat.com/solutions/closed-loop-ticketing/,https://ambisecure.ambimat.com/solutions/closed-loop-ticketing/,Closed-loop ticketing — transit-grade architecture | AmbiSecure,solution,True,https://ambisecure.ambimat.com/assets/img/og/featured/ambisecure-solutions-closed-loop-ticketing-1200x630.png,https://ambisecure.ambimat.com/assets/img/og/featured/ambisecure-solutions-closed-loop-ticketing-1200x630.png,assets/img/og/featured/ambisecure-solutions-closed-loop-ticketing-1200x630.png,True,image/png,1200,630,54358,"Architecture stack for Closed-loop ticketing — transit-grade architecture, end to end., layered from desfire ev2 / ev3 credentials down to a hardware…","Architecture stack for Closed-loop ticketing — transit-grade architecture, end to end., layered from desfire ev2 / ev3 credentials down to a hardware…",unique,False,,Brand-consistent (generated featured art),
https://ambisecure.ambimat.com/solutions/device-identity-at-scale/,https://ambisecure.ambimat.com/solutions/device-identity-at-scale/,"Device Identity at Scale — hardware roots, lifecycle | AmbiSecure",solution,True,https://ambisecure.ambimat.com/assets/img/og/featured/ambisecure-solutions-device-identity-at-scale-1200x630.png,https://ambisecure.ambimat.com/assets/img/og/featured/ambisecure-solutions-device-identity-at-scale-1200x630.png,assets/img/og/featured/ambisecure-solutions-device-identity-at-scale-1200x630.png,True,image/png,1200,630,46189,"Architecture stack for Device identity at scale., layered from fleet revocation + ota re-key down to a hardware root of trust.","Architecture stack for Device identity at scale., layered from fleet revocation + ota re-key down to a hardware root of trust.",unique,False,,Brand-consistent (generated featured art),
https://ambisecure.ambimat.com/solutions/esim-security/,https://ambisecure.ambimat.com/solutions/esim-security/,eSIM Security — AmbiSecure | SGP.22 / SGP.32 / RSP,solution,True,https://ambisecure.ambimat.com/assets/img/og/featured/ambisecure-solutions-esim-security-1200x630.png,https://ambisecure.ambimat.com/assets/img/og/featured/ambisecure-solutions-esim-security-1200x630.png,assets/img/og/featured/ambisecure-solutions-esim-security-1200x630.png,True,image/png,1200,630,57391,"Architecture stack for eSIM security — SGP.22, GSMA, and what actually deploys., layered from sm-dp+ — operator profiles down to a hardware root of trust.","Architecture stack for eSIM security — SGP.22, GSMA, and what actually deploys., layered from sm-dp+ — operator profiles down to a hardware root of trust.",unique,False,,Brand-consistent (generated featured art),
https://ambisecure.ambimat.com/solutions/government-identity/,https://ambisecure.ambimat.com/solutions/government-identity/,"Government Identity — high-assurance, attested | AmbiSecure",solution,True,https://ambisecure.ambimat.com/assets/img/og/featured/ambisecure-solutions-government-identity-1200x630.png,https://ambisecure.ambimat.com/assets/img/og/featured/ambisecure-solutions-government-identity-1200x630.png,assets/img/og/featured/ambisecure-solutions-government-identity-1200x630.png,True,image/png,1200,630,58396,"Architecture stack for Government identity — high-assurance, attestation-anchored., layered from air-gap-tolerant validation down to a hardware root of…","Architecture stack for Government identity — high-assurance, attestation-anchored., layered from air-gap-tolerant validation down to a hardware root of…",unique,False,,Brand-consistent (generated featured art),
https://ambisecure.ambimat.com/solutions/,https://ambisecure.ambimat.com/solutions/,"Solutions &mdash; passwordless, IoT root of trust, provisioning",solution-index,True,https://ambisecure.ambimat.com/assets/img/og/featured/ambisecure-solutions-1200x630.png,https://ambisecure.ambimat.com/assets/img/og/featured/ambisecure-solutions-1200x630.png,assets/img/og/featured/ambisecure-solutions-1200x630.png,True,image/png,1200,630,94053,"AmbiSecure hardware root of trust anchoring workforce, connected-device, embedded and PKI solution areas.","AmbiSecure hardware root of trust anchoring workforce, connected-device, embedded and PKI solution areas.",unique,True,ambisecure-solutions-1200x630.png,Approved reference image,
https://ambisecure.ambimat.com/solutions/javacard-deployment/,https://ambisecure.ambimat.com/solutions/javacard-deployment/,JavaCard Applet Deployment — AmbiSecure | Spec to shipment,solution,True,https://ambisecure.ambimat.com/assets/img/og/featured/ambisecure-solutions-javacard-deployment-1200x630.png,https://ambisecure.ambimat.com/assets/img/og/featured/ambisecure-solutions-javacard-deployment-1200x630.png,assets/img/og/featured/ambisecure-solutions-javacard-deployment-1200x630.png,True,image/png,1200,630,54138,"Architecture stack for JavaCard applet deployment — what actually ships., layered from fido2 · piv · openpgp · emv down to a hardware root of trust.","Architecture stack for JavaCard applet deployment — what actually ships., layered from fido2 · piv · openpgp · emv down to a hardware root of trust.",unique,False,,Brand-consistent (generated featured art),
https://ambisecure.ambimat.com/solutions/offline-authentication/,https://ambisecure.ambimat.com/solutions/offline-authentication/,Offline authentication | AmbiSecure,solution,True,https://ambisecure.ambimat.com/assets/img/og/featured/ambisecure-solutions-offline-authentication-1200x630.png,https://ambisecure.ambimat.com/assets/img/og/featured/ambisecure-solutions-offline-authentication-1200x630.png,assets/img/og/featured/ambisecure-solutions-offline-authentication-1200x630.png,True,image/png,1200,630,49386,"Architecture stack for Offline authentication — trust without a network., layered from deferred reconciliation down to a hardware root of trust.","Architecture stack for Offline authentication — trust without a network., layered from deferred reconciliation down to a hardware root of trust.",unique,False,,Brand-consistent (generated featured art),
https://ambisecure.ambimat.com/solutions/passwordless-enterprise/,https://ambisecure.ambimat.com/solutions/passwordless-enterprise/,"Passwordless Enterprise — real, not hidden passwords | AmbiSecure",solution,True,https://ambisecure.ambimat.com/assets/img/og/featured/ambisecure-solutions-passwordless-enterprise-1200x630.png,https://ambisecure.ambimat.com/assets/img/og/featured/ambisecure-solutions-passwordless-enterprise-1200x630.png,assets/img/og/featured/ambisecure-solutions-passwordless-enterprise-1200x630.png,True,image/png,1200,630,84866,AmbiSecure hardware authenticator replacing a terminated password path with a device-bound public-key path to enterprise access.,AmbiSecure hardware authenticator replacing a terminated password path with a device-bound public-key path to enterprise access.,unique,True,ambisecure-solutions-passwordless-enterprise-1200x630.png,Approved reference image,
https://ambisecure.ambimat.com/solutions/passwordless-mfa/,https://ambisecure.ambimat.com/solutions/passwordless-mfa/,Passwordless &amp; MFA — hardware-bound enterprise auth | AmbiSecure,solution,True,https://ambisecure.ambimat.com/assets/img/og/featured/ambisecure-solutions-passwordless-mfa-1200x630.png,https://ambisecure.ambimat.com/assets/img/og/featured/ambisecure-solutions-passwordless-mfa-1200x630.png,assets/img/og/featured/ambisecure-solutions-passwordless-mfa-1200x630.png,True,image/png,1200,630,55283,"Architecture stack for Passwordless & MFA — without the OTP fatigue., layered from identity provider — saml/oidc down to a hardware root of trust.","Architecture stack for Passwordless & MFA — without the OTP fatigue., layered from identity provider — saml/oidc down to a hardware root of trust.",unique,False,,Brand-consistent (generated featured art),
https://ambisecure.ambimat.com/solutions/phishing-resistant-authentication/,https://ambisecure.ambimat.com/solutions/phishing-resistant-authentication/,Phishing-resistant Authentication — AmbiSecure | What it really means,solution,True,https://ambisecure.ambimat.com/assets/img/og/featured/ambisecure-solutions-phishing-resistant-authentication-1200x630.png,https://ambisecure.ambimat.com/assets/img/og/featured/ambisecure-solutions-phishing-resistant-authentication-1200x630.png,assets/img/og/featured/ambisecure-solutions-phishing-resistant-authentication-1200x630.png,True,image/png,1200,630,87590,AmbiSecure authenticator completing authentication only with the legitimate origin while a lookalike origin fails.,AmbiSecure authenticator completing authentication only with the legitimate origin while a lookalike origin fails.,unique,True,ambisecure-solutions-phishing-resistant-authentication-1200x630.png,Approved reference image,
https://ambisecure.ambimat.com/solutions/secure-element-integration/,https://ambisecure.ambimat.com/solutions/secure-element-integration/,Secure Element Integration — AmbiSecure | Silicon-to-cloud,solution,True,https://ambisecure.ambimat.com/assets/img/og/featured/ambisecure-solutions-secure-element-integration-1200x630.png,https://ambisecure.ambimat.com/assets/img/og/featured/ambisecure-solutions-secure-element-integration-1200x630.png,assets/img/og/featured/ambisecure-solutions-secure-element-integration-1200x630.png,True,image/png,1200,630,82957,AmbiSecure secure element holding keys at the base of a layered stack while verified operations rise to the trusted cloud.,AmbiSecure secure element holding keys at the base of a layered stack while verified operations rise to the trusted cloud.,unique,True,ambisecure-solutions-secure-element-integration-1200x630.png,Approved reference image,
https://ambisecure.ambimat.com/solutions/secure-validator-platforms/,https://ambisecure.ambimat.com/solutions/secure-validator-platforms/,Secure validator platforms | AmbiSecure,solution,True,https://ambisecure.ambimat.com/assets/img/og/featured/ambisecure-solutions-secure-validator-platforms-1200x630.png,https://ambisecure.ambimat.com/assets/img/og/featured/ambisecure-solutions-secure-validator-platforms-1200x630.png,assets/img/og/featured/ambisecure-solutions-secure-validator-platforms-1200x630.png,True,image/png,1200,630,48639,"Architecture stack for Secure validator platforms., layered from tamper-evident enclosure down to a hardware root of trust.","Architecture stack for Secure validator platforms., layered from tamper-evident enclosure down to a hardware root of trust.",unique,False,,Brand-consistent (generated featured art),
https://ambisecure.ambimat.com/solutions/smart-access-control/,https://ambisecure.ambimat.com/solutions/smart-access-control/,Smart access control | AmbiSecure,solution,True,https://ambisecure.ambimat.com/assets/img/og/featured/ambisecure-solutions-smart-access-control-1200x630.png,https://ambisecure.ambimat.com/assets/img/og/featured/ambisecure-solutions-smart-access-control-1200x630.png,assets/img/og/featured/ambisecure-solutions-smart-access-control-1200x630.png,True,image/png,1200,630,51594,"Architecture stack for Smart access control — one credential, every door., layered from doors, laptops, elevators down to a hardware root of trust.","Architecture stack for Smart access control — one credential, every door., layered from doors, laptops, elevators down to a hardware root of trust.",unique,False,,Brand-consistent (generated featured art),
https://ambisecure.ambimat.com/solutions/smart-card-personalization/,https://ambisecure.ambimat.com/solutions/smart-card-personalization/,Smart-Card Personalisation — AmbiSecure | Issuance line,solution,True,https://ambisecure.ambimat.com/assets/img/og/featured/ambisecure-solutions-smart-card-personalization-1200x630.png,https://ambisecure.ambimat.com/assets/img/og/featured/ambisecure-solutions-smart-card-personalization-1200x630.png,assets/img/og/featured/ambisecure-solutions-smart-card-personalization-1200x630.png,True,image/png,1200,630,45852,"Architecture stack for Smart-card personalisation — the line, not just the card., layered from manifest + graded cards out down to a hardware root of…","Architecture stack for Smart-card personalisation — the line, not just the card., layered from manifest + graded cards out down to a hardware root of…",unique,False,,Brand-consistent (generated featured art),
https://ambisecure.ambimat.com/solutions/transit-ticketing/,https://ambisecure.ambimat.com/solutions/transit-ticketing/,Transit ticketing — closed-loop deployments | AmbiSecure,solution,True,https://ambisecure.ambimat.com/assets/img/og/featured/ambisecure-solutions-transit-ticketing-1200x630.png,https://ambisecure.ambimat.com/assets/img/og/featured/ambisecure-solutions-transit-ticketing-1200x630.png,assets/img/og/featured/ambisecure-solutions-transit-ticketing-1200x630.png,True,image/png,1200,630,52389,"Architecture stack for Transit ticketing — the deployment, not the slide., layered from back-office connectors down to a hardware root of trust.","Architecture stack for Transit ticketing — the deployment, not the slide., layered from back-office connectors down to a hardware root of trust.",unique,False,,Brand-consistent (generated featured art),
https://ambisecure.ambimat.com/solutions/v2x-security/,https://ambisecure.ambimat.com/solutions/v2x-security/,"V2X Security Architecture — OBU, RSU, and ITS PKI | AmbiSecure",solution,True,https://ambisecure.ambimat.com/assets/img/og/featured/ambisecure-solutions-v2x-security-1200x630.png,https://ambisecure.ambimat.com/assets/img/og/featured/ambisecure-solutions-v2x-security-1200x630.png,assets/img/og/featured/ambisecure-solutions-v2x-security-1200x630.png,True,image/png,1200,630,84980,"AmbiSecure vehicle onboard unit with a secure element exchanging signed, verified V2X messages with a roadside unit and PKI trust service.","AmbiSecure vehicle onboard unit with a secure element exchanging signed, verified V2X messages with a roadside unit and PKI trust service.",unique,True,ambisecure-solutions-v2x-security-1200x630.png,Approved reference image,
