url,canonical,title,page_type,indexable,og_image,twitter_image,local_path,img_exists,img_mime,img_w,img_h,img_bytes,og_image_alt,twitter_image_alt,unique_or_shared,is_approved,approved_file,classification,problems
https://ambisecure.ambimat.com/about/certifications/,https://ambisecure.ambimat.com/about/certifications/,Certifications &amp; Standards &mdash; AmbiSecure | Trust documents,company,True,https://ambisecure.ambimat.com/assets/img/og/featured/ambisecure-about-certifications-1200x630.png,https://ambisecure.ambimat.com/assets/img/og/featured/ambisecure-about-certifications-1200x630.png,assets/img/og/featured/ambisecure-about-certifications-1200x630.png,True,image/png,1200,630,57413,"Architecture stack for Certifications, standards posture, and trust documents., layered from frameworks — nist, eidas, cra down to a hardware root of…","Architecture stack for Certifications, standards posture, and trust documents., layered from frameworks — nist, eidas, cra down to a hardware root of…",unique,False,,Brand-consistent (generated featured art),
https://ambisecure.ambimat.com/about/,https://ambisecure.ambimat.com/about/,About AmbiSecure &mdash; hardware-rooted security,company,True,https://ambisecure.ambimat.com/assets/img/og/featured/ambisecure-about-1200x630.png,https://ambisecure.ambimat.com/assets/img/og/featured/ambisecure-about-1200x630.png,assets/img/og/featured/ambisecure-about-1200x630.png,True,image/png,1200,630,80226,"AmbiSecure embedded-engineering and secure-element development work grounded in Ahmedabad, India.","AmbiSecure embedded-engineering and secure-element development work grounded in Ahmedabad, India.",unique,True,ambisecure-about-1200x630.png,Approved reference image,
https://ambisecure.ambimat.com/blog/ambisecure-products-cra-readiness/,https://ambisecure.ambimat.com/blog/ambisecure-products-cra-readiness/,AmbiSecure Products &amp; CRA Readiness | AmbiSecure,blog,True,https://ambisecure.ambimat.com/assets/img/og/featured/ambisecure-blog-ambisecure-products-cra-readiness-1200x630.png,https://ambisecure.ambimat.com/assets/img/og/featured/ambisecure-blog-ambisecure-products-cra-readiness-1200x630.png,assets/img/og/featured/ambisecure-blog-ambisecure-products-cra-readiness-1200x630.png,True,image/png,1200,630,47894,"Mapping table pairing CRA-aligned security needs with AmbiSecure building blocks — AmbiSEC device identity, OnePass credentials and BioKey user authentication.","Mapping table pairing CRA-aligned security needs with AmbiSecure building blocks — AmbiSEC device identity, OnePass credentials and BioKey user authentication.",unique,False,,Brand-consistent (generated featured art),
https://ambisecure.ambimat.com/blog/apdu-from-first-principles/,https://ambisecure.ambimat.com/blog/apdu-from-first-principles/,"APDU from First Principles — CLA, INS, P1/P2, SW | AmbiSecure",blog,True,https://ambisecure.ambimat.com/assets/img/og/featured/ambisecure-blog-apdu-from-first-principles-1200x630.png,https://ambisecure.ambimat.com/assets/img/og/featured/ambisecure-blog-apdu-from-first-principles-1200x630.png,assets/img/og/featured/ambisecure-blog-apdu-from-first-principles-1200x630.png,True,image/png,1200,630,54760,"Byte-level anatomy of an ISO/IEC 7816-4 command APDU across its four cases, showing how CLA, INS, P1/P2, Lc, Le and SW1/SW2 frame every smart-card exchange.","Byte-level anatomy of an ISO/IEC 7816-4 command APDU across its four cases, showing how CLA, INS, P1/P2, Lc, Le and SW1/SW2 frame every smart-card exchange.",unique,False,,Brand-consistent (generated featured art),
https://ambisecure.ambimat.com/blog/archive/common-misconceptions-about-2fa/,https://ambisecure.ambimat.com/blog/archive/common-misconceptions-about-2fa/,Common Misconceptions About 2FA | AmbiSecure (Archive 2021),blog,True,https://ambisecure.ambimat.com/assets/img/og/featured/ambisecure-blog-archive-common-misconceptions-about-2fa-1200x630.png,https://ambisecure.ambimat.com/assets/img/og/featured/ambisecure-blog-archive-common-misconceptions-about-2fa-1200x630.png,assets/img/og/featured/ambisecure-blog-archive-common-misconceptions-about-2fa-1200x630.png,True,image/png,1200,630,46318,"Common second factors tested against phishing and interception, showing why only origin-bound hardware authenticators survive a credential-relay attack.","Common second factors tested against phishing and interception, showing why only origin-bound hardware authenticators survive a credential-relay attack.",unique,False,,Brand-consistent (generated featured art),
https://ambisecure.ambimat.com/blog/archive/consumer-biometrics-and-privacy/,https://ambisecure.ambimat.com/blog/archive/consumer-biometrics-and-privacy/,Consumer Biometrics &amp; Privacy | AmbiSecure (Archive 2020),blog,True,https://ambisecure.ambimat.com/assets/img/og/featured/ambisecure-blog-archive-consumer-biometrics-and-privacy-1200x630.png,https://ambisecure.ambimat.com/assets/img/og/featured/ambisecure-blog-archive-consumer-biometrics-and-privacy-1200x630.png,assets/img/og/featured/ambisecure-blog-archive-consumer-biometrics-and-privacy-1200x630.png,True,image/png,1200,630,44825,"Two-column comparison of match-on-device against match-on-server, tracing an irreversible template to the secure element where AmbiSecure keeps the comparison.","Two-column comparison of match-on-device against match-on-server, tracing an irreversible template to the secure element where AmbiSecure keeps the comparison.",unique,False,,Brand-consistent (generated featured art),
https://ambisecure.ambimat.com/blog/archive/cyber-attacks-in-india-part-1/,https://ambisecure.ambimat.com/blog/archive/cyber-attacks-in-india-part-1/,Cyber Attacks in India (Archive 2021) — AmbiSecure Blog,blog,True,https://ambisecure.ambimat.com/assets/img/og/featured/ambisecure-blog-archive-cyber-attacks-in-india-part-1-1200x630.png,https://ambisecure.ambimat.com/assets/img/og/featured/ambisecure-blog-archive-cyber-attacks-in-india-part-1-1200x630.png,assets/img/og/featured/ambisecure-blog-archive-cyber-attacks-in-india-part-1-1200x630.png,True,image/png,1200,630,52474,"Landmark Indian banking and identity incidents converging on one shared root: secrets a person could hand over, and access paths that nothing attested.","Landmark Indian banking and identity incidents converging on one shared root: secrets a person could hand over, and access paths that nothing attested.",unique,False,,Brand-consistent (generated featured art),
https://ambisecure.ambimat.com/blog/archive/cyber-attacks-in-india-part-2/,https://ambisecure.ambimat.com/blog/archive/cyber-attacks-in-india-part-2/,Cyber Attacks in India – Part 2 (Archive 2021) — AmbiSecure Blog,blog,True,https://ambisecure.ambimat.com/assets/img/og/featured/ambisecure-blog-archive-cyber-attacks-in-india-part-2-1200x630.png,https://ambisecure.ambimat.com/assets/img/og/featured/ambisecure-blog-archive-cyber-attacks-in-india-part-2-1200x630.png,assets/img/og/featured/ambisecure-blog-archive-cyber-attacks-in-india-part-2-1200x630.png,True,image/png,1200,630,53450,"Five Indian data-exposure incidents drawn as a perimeter row, each mapped to the access control it lacked, from an unsecured SMS server to a third-party KYC warehouse.","Five Indian data-exposure incidents drawn as a perimeter row, each mapped to the access control it lacked, from an unsecured SMS server to a third-party KYC warehouse.",unique,False,,Brand-consistent (generated featured art),
https://ambisecure.ambimat.com/blog/archive/cyber-attacks-in-india-part-3/,https://ambisecure.ambimat.com/blog/archive/cyber-attacks-in-india-part-3/,Cyber Attacks in India – Part 3 (Archive 2021) — AmbiSecure Blog,blog,True,https://ambisecure.ambimat.com/assets/img/og/featured/ambisecure-blog-archive-cyber-attacks-in-india-part-3-1200x630.png,https://ambisecure.ambimat.com/assets/img/og/featured/ambisecure-blog-archive-cyber-attacks-in-india-part-3-1200x630.png,assets/img/og/featured/ambisecure-blog-archive-cyber-attacks-in-india-part-3-1200x630.png,True,image/png,1200,630,43703,"Disclosure-lag bars across five Indian consumer-data breaches, tracing the incident-response and credential-hygiene gaps that closed this archive series.","Disclosure-lag bars across five Indian consumer-data breaches, tracing the incident-response and credential-hygiene gaps that closed this archive series.",unique,False,,Brand-consistent (generated featured art),
https://ambisecure.ambimat.com/blog/archive/emv-certification-in-public-transport/,https://ambisecure.ambimat.com/blog/archive/emv-certification-in-public-transport/,EMV Certification in Public Transport | AmbiSecure (Archive 2020),blog,True,https://ambisecure.ambimat.com/assets/img/og/featured/ambisecure-blog-archive-emv-certification-in-public-transport-1200x630.png,https://ambisecure.ambimat.com/assets/img/og/featured/ambisecure-blog-archive-emv-certification-in-public-transport-1200x630.png,assets/img/og/featured/ambisecure-blog-archive-emv-certification-in-public-transport-1200x630.png,True,image/png,1200,630,42080,"Certification ladder splitting EMV Level 1 hardware, Level 2 kernel and Level 3 brand testing, with the body that owns each rung in a transit rollout.","Certification ladder splitting EMV Level 1 hardware, Level 2 kernel and Level 3 brand testing, with the body that owns each rung in a transit rollout.",unique,False,,Brand-consistent (generated featured art),
https://ambisecure.ambimat.com/blog/archive/enterprise-security-threats/,https://ambisecure.ambimat.com/blog/archive/enterprise-security-threats/,Enterprise Security Threats (Archive 2021) — AmbiSecure Blog,blog,True,https://ambisecure.ambimat.com/assets/img/og/featured/ambisecure-blog-archive-enterprise-security-threats-1200x630.png,https://ambisecure.ambimat.com/assets/img/og/featured/ambisecure-blog-archive-enterprise-security-threats-1200x630.png,assets/img/og/featured/ambisecure-blog-archive-enterprise-security-threats-1200x630.png,True,image/png,1200,630,53272,"The enterprise attack surface widening across cloud, SaaS, contractor, BYOD and IoT entry points, and the credential-controlled wedge hardware-rooted identity narrows.","The enterprise attack surface widening across cloud, SaaS, contractor, BYOD and IoT entry points, and the credential-controlled wedge hardware-rooted identity narrows.",unique,False,,Brand-consistent (generated featured art),
https://ambisecure.ambimat.com/blog/archive/epassport-applications/,https://ambisecure.ambimat.com/blog/archive/epassport-applications/,ePassport and Its Application (Archive 2021) — AmbiSecure Blog,blog,True,https://ambisecure.ambimat.com/assets/img/og/featured/ambisecure-blog-archive-epassport-applications-1200x630.png,https://ambisecure.ambimat.com/assets/img/og/featured/ambisecure-blog-archive-epassport-applications-1200x630.png,assets/img/og/featured/ambisecure-blog-archive-epassport-applications-1200x630.png,True,image/png,1200,630,50706,"Border-control lane tracing an ICAO 9303 ePassport from airline check-in to eGate, showing why the biometric template stays inside the chip's secure element.","Border-control lane tracing an ICAO 9303 ePassport from airline check-in to eGate, showing why the biometric template stays inside the chip's secure element.",unique,False,,Brand-consistent (generated featured art),
https://ambisecure.ambimat.com/blog/archive/fast-identity-online/,https://ambisecure.ambimat.com/blog/archive/fast-identity-online/,Fast Identity Online (FIDO) (Archive 2020) — AmbiSecure Blog,blog,True,https://ambisecure.ambimat.com/assets/img/og/featured/ambisecure-blog-archive-fast-identity-online-1200x630.png,https://ambisecure.ambimat.com/assets/img/og/featured/ambisecure-blog-archive-fast-identity-online-1200x630.png,assets/img/og/featured/ambisecure-blog-archive-fast-identity-online-1200x630.png,True,image/png,1200,630,45436,"Split diagram contrasting a phishable central secret store with an AmbiSecure authenticator signing an origin-bound challenge, private key never leaving.","Split diagram contrasting a phishable central secret store with an AmbiSecure authenticator signing an origin-bound challenge, private key never leaving.",unique,False,,Brand-consistent (generated featured art),
https://ambisecure.ambimat.com/blog/archive/how-chip-based-epassports-work/,https://ambisecure.ambimat.com/blog/archive/how-chip-based-epassports-work/,How Chip-Based ePassports Work | AmbiSecure (Archive 2021),blog,True,https://ambisecure.ambimat.com/assets/img/og/featured/ambisecure-blog-archive-how-chip-based-epassports-work-1200x630.png,https://ambisecure.ambimat.com/assets/img/og/featured/ambisecure-blog-archive-how-chip-based-epassports-work-1200x630.png,assets/img/og/featured/ambisecure-blog-archive-how-chip-based-epassports-work-1200x630.png,True,image/png,1200,630,48334,"The contactless inlay inside a biometric passport, with the ICAO 9303 signing chain above it and the PACE-protected read path an inspection system must complete first.","The contactless inlay inside a biometric passport, with the ICAO 9303 signing chain above it and the PACE-protected read path an inspection system must complete first.",unique,False,,Brand-consistent (generated featured art),
https://ambisecure.ambimat.com/blog/archive/,https://ambisecure.ambimat.com/blog/archive/,Engineering Archive &mdash; AmbiSecure Blog,blog,True,https://ambisecure.ambimat.com/assets/img/og/featured/ambisecure-blog-archive-1200x630.png,https://ambisecure.ambimat.com/assets/img/og/featured/ambisecure-blog-archive-1200x630.png,assets/img/og/featured/ambisecure-blog-archive-1200x630.png,True,image/png,1200,630,54638,"Illustration for AmbiSecure engineering writing — 2017 through today., showing 24 entries, 2017 onwards anchored in hardware-rooted security.","Illustration for AmbiSecure engineering writing — 2017 through today., showing 24 entries, 2017 onwards anchored in hardware-rooted security.",unique,False,,Brand-consistent (generated featured art),
https://ambisecure.ambimat.com/blog/archive/introduction-to-java-card/,https://ambisecure.ambimat.com/blog/archive/introduction-to-java-card/,Introduction to Java Card | AmbiSecure (Archive 2020),blog,True,https://ambisecure.ambimat.com/assets/img/og/featured/ambisecure-blog-archive-introduction-to-java-card-1200x630.png,https://ambisecure.ambimat.com/assets/img/og/featured/ambisecure-blog-archive-introduction-to-java-card-1200x630.png,assets/img/og/featured/ambisecure-blog-archive-introduction-to-java-card-1200x630.png,True,image/png,1200,630,50820,"Chip cutaway of the JavaCard runtime and applet firewall, showing how AmbiSecure keeps co-resident FIDO, PIV and ePassport applets isolated on a single die.","Chip cutaway of the JavaCard runtime and applet firewall, showing how AmbiSecure keeps co-resident FIDO, PIV and ePassport applets isolated on a single die.",unique,False,,Brand-consistent (generated featured art),
https://ambisecure.ambimat.com/blog/archive/iot-security-challenges-part-1/,https://ambisecure.ambimat.com/blog/archive/iot-security-challenges-part-1/,Challenges to IoT Security (Part 1) (Archive 2020) — AmbiSecure Blog,blog,True,https://ambisecure.ambimat.com/assets/img/og/featured/ambisecure-blog-archive-iot-security-challenges-part-1-1200x630.png,https://ambisecure.ambimat.com/assets/img/og/featured/ambisecure-blog-archive-iot-security-challenges-part-1-1200x630.png,assets/img/og/featured/ambisecure-blog-archive-iot-security-challenges-part-1-1200x630.png,True,image/png,1200,630,52513,"One IoT device with its attack surface fanned out — default credentials, stale firmware, plaintext links — and the empty slot where a trust anchor belongs.","One IoT device with its attack surface fanned out — default credentials, stale firmware, plaintext links — and the empty slot where a trust anchor belongs.",unique,False,,Brand-consistent (generated featured art),
https://ambisecure.ambimat.com/blog/archive/iot-security-challenges-part-2/,https://ambisecure.ambimat.com/blog/archive/iot-security-challenges-part-2/,Challenges to IoT Security (Part 2) (Archive 2020) — AmbiSecure Blog,blog,True,https://ambisecure.ambimat.com/assets/img/og/featured/ambisecure-blog-archive-iot-security-challenges-part-2-1200x630.png,https://ambisecure.ambimat.com/assets/img/og/featured/ambisecure-blog-archive-iot-security-challenges-part-2-1200x630.png,assets/img/og/featured/ambisecure-blog-archive-iot-security-challenges-part-2-1200x630.png,True,image/png,1200,630,53778,"Fleet grid where a compromised IoT device stays indistinguishable from its neighbours, mapping the blind spots hardware-rooted identity is meant to narrow.","Fleet grid where a compromised IoT device stays indistinguishable from its neighbours, mapping the blind spots hardware-rooted identity is meant to narrow.",unique,False,,Brand-consistent (generated featured art),
https://ambisecure.ambimat.com/blog/archive/is-passwordless-the-future/,https://ambisecure.ambimat.com/blog/archive/is-passwordless-the-future/,Is Passwordless the future? (Archive 2021) — AmbiSecure Blog,blog,True,https://ambisecure.ambimat.com/assets/img/og/featured/ambisecure-blog-archive-is-passwordless-the-future-1200x630.png,https://ambisecure.ambimat.com/assets/img/og/featured/ambisecure-blog-archive-is-passwordless-the-future-1200x630.png,assets/img/og/featured/ambisecure-blog-archive-is-passwordless-the-future-1200x630.png,True,image/png,1200,630,48467,"Architectural contrast between a server holding password hashes worth stealing and one holding only a public key, the shift AmbiSecure's FIDO2 hardware makes possible.","Architectural contrast between a server holding password hashes worth stealing and one holding only a public key, the shift AmbiSecure's FIDO2 hardware makes possible.",unique,False,,Brand-consistent (generated featured art),
https://ambisecure.ambimat.com/blog/archive/mfa-in-government/,https://ambisecure.ambimat.com/blog/archive/mfa-in-government/,MFA in Government Sector | AmbiSecure (Archive 2021),blog,True,https://ambisecure.ambimat.com/assets/img/og/featured/ambisecure-blog-archive-mfa-in-government-1200x630.png,https://ambisecure.ambimat.com/assets/img/og/featured/ambisecure-blog-archive-mfa-in-government-1200x630.png,assets/img/og/featured/ambisecure-blog-archive-mfa-in-government-1200x630.png,True,image/png,1200,630,49508,"A phishing proxy fronting a government portal, succeeding against a typed SMS code but failing against the origin-bound FIDO2 credential on an AmbiSecure authenticator.","A phishing proxy fronting a government portal, succeeding against a typed SMS code but failing against the origin-bound FIDO2 credential on an AmbiSecure authenticator.",unique,False,,Brand-consistent (generated featured art),
https://ambisecure.ambimat.com/blog/archive/public-transport-ticketing-part-1/,https://ambisecure.ambimat.com/blog/archive/public-transport-ticketing-part-1/,Public Transport Ticketing (Part 1) | AmbiSecure (Archive 2020),blog,True,https://ambisecure.ambimat.com/assets/img/og/featured/ambisecure-blog-archive-public-transport-ticketing-part-1-1200x630.png,https://ambisecure.ambimat.com/assets/img/og/featured/ambisecure-blog-archive-public-transport-ticketing-part-1-1200x630.png,assets/img/og/featured/ambisecure-blog-archive-public-transport-ticketing-part-1-1200x630.png,True,image/png,1200,630,51906,"Five-column comparison of NCMC, Yikatong, Riyadh, T-money and Suica fare architectures, showing what each Asian network optimised for and where card keys stay.","Five-column comparison of NCMC, Yikatong, Riyadh, T-money and Suica fare architectures, showing what each Asian network optimised for and where card keys stay.",unique,False,,Brand-consistent (generated featured art),
https://ambisecure.ambimat.com/blog/archive/public-transport-ticketing-part-2/,https://ambisecure.ambimat.com/blog/archive/public-transport-ticketing-part-2/,Public Transport Ticketing (Part 2) | AmbiSecure (Archive 2020),blog,True,https://ambisecure.ambimat.com/assets/img/og/featured/ambisecure-blog-archive-public-transport-ticketing-part-2-1200x630.png,https://ambisecure.ambimat.com/assets/img/og/featured/ambisecure-blog-archive-public-transport-ticketing-part-2-1200x630.png,assets/img/og/featured/ambisecure-blog-archive-public-transport-ticketing-part-2-1200x630.png,True,image/png,1200,630,46129,"Europe and Latin America fare systems from Oyster to RioCard, showing closed-loop cards and open-loop bank cards converging on a single contactless validator.","Europe and Latin America fare systems from Oyster to RioCard, showing closed-loop cards and open-loop bank cards converging on a single contactless validator.",unique,False,,Brand-consistent (generated featured art),
https://ambisecure.ambimat.com/blog/archive/public-transport-ticketing-part-3/,https://ambisecure.ambimat.com/blog/archive/public-transport-ticketing-part-3/,Public Transport Ticketing (Part 3) | AmbiSecure (Archive 2020),blog,True,https://ambisecure.ambimat.com/assets/img/og/featured/ambisecure-blog-archive-public-transport-ticketing-part-3-1200x630.png,https://ambisecure.ambimat.com/assets/img/og/featured/ambisecure-blog-archive-public-transport-ticketing-part-3-1200x630.png,assets/img/og/featured/ambisecure-blog-archive-public-transport-ticketing-part-3-1200x630.png,True,image/png,1200,630,54477,"Hub-and-spoke diagram placing an EZ-Link transit card at the centre, linked to MRT/LRT, bus, taxi and ERP gantry payment points.","Hub-and-spoke diagram placing an EZ-Link transit card at the centre, linked to MRT/LRT, bus, taxi and ERP gantry payment points.",unique,False,,Brand-consistent (generated featured art),
https://ambisecure.ambimat.com/blog/archive/securing-iiot-infrastructure/,https://ambisecure.ambimat.com/blog/archive/securing-iiot-infrastructure/,Securing your IIoT infrastructure (Archive 2020) — AmbiSecure Blog,blog,True,https://ambisecure.ambimat.com/assets/img/og/featured/ambisecure-blog-archive-securing-iiot-infrastructure-1200x630.png,https://ambisecure.ambimat.com/assets/img/og/featured/ambisecure-blog-archive-securing-iiot-infrastructure-1200x630.png,assets/img/og/featured/ambisecure-blog-archive-securing-iiot-infrastructure-1200x630.png,True,image/png,1200,630,47660,"Cutaway of a PLC cabinet layering control network out to the IT boundary, showing why AmbiSecure puts device keys in embedded crypto inside the controller.","Cutaway of a PLC cabinet layering control network out to the IT boundary, showing why AmbiSecure puts device keys in embedded crypto inside the controller.",unique,False,,Brand-consistent (generated featured art),
https://ambisecure.ambimat.com/blog/archive/single-sign-on-vs-mfa/,https://ambisecure.ambimat.com/blog/archive/single-sign-on-vs-mfa/,Single Sign-On vs MFA | AmbiSecure (Archive 2021),blog,True,https://ambisecure.ambimat.com/assets/img/og/featured/ambisecure-blog-archive-single-sign-on-vs-mfa-1200x630.png,https://ambisecure.ambimat.com/assets/img/og/featured/ambisecure-blog-archive-single-sign-on-vs-mfa-1200x630.png,assets/img/og/featured/ambisecure-blog-archive-single-sign-on-vs-mfa-1200x630.png,True,image/png,1200,630,51655,Two-plane view of an enterprise login: an SSO session carrying identity across apps while an AmbiSecure authenticator supplies the cryptographic proof beneath it.,Two-plane view of an enterprise login: an SSO session carrying identity across apps while an AmbiSecure authenticator supplies the cryptographic proof beneath it.,unique,False,,Brand-consistent (generated featured art),
https://ambisecure.ambimat.com/blog/archive/sms-otp-disadvantages/,https://ambisecure.ambimat.com/blog/archive/sms-otp-disadvantages/,SMS-Based OTP Disadvantages | AmbiSecure (Archive 2021),blog,True,https://ambisecure.ambimat.com/assets/img/og/featured/ambisecure-blog-archive-sms-otp-disadvantages-1200x630.png,https://ambisecure.ambimat.com/assets/img/og/featured/ambisecure-blog-archive-sms-otp-disadvantages-1200x630.png,assets/img/og/featured/ambisecure-blog-archive-sms-otp-disadvantages-1200x630.png,True,image/png,1200,630,50739,"The SMS one-time-password delivery path with its SIM-swap, SS7 and relay tap points, set against a FIDO2 exchange that never touches the telecom network.","The SMS one-time-password delivery path with its SIM-swap, SS7 and relay tap points, set against a FIDO2 exchange that never touches the telecom network.",unique,False,,Brand-consistent (generated featured art),
https://ambisecure.ambimat.com/blog/archive/what-is-passwordless-authentication/,https://ambisecure.ambimat.com/blog/archive/what-is-passwordless-authentication/,What is Passwordless Authentication? (Archive 2021) — AmbiSecure Blog,blog,True,https://ambisecure.ambimat.com/assets/img/og/featured/ambisecure-blog-archive-what-is-passwordless-authentication-1200x630.png,https://ambisecure.ambimat.com/assets/img/og/featured/ambisecure-blog-archive-what-is-passwordless-authentication-1200x630.png,assets/img/og/featured/ambisecure-blog-archive-what-is-passwordless-authentication-1200x630.png,True,image/png,1200,630,44526,"How FIDO2 registration keeps the private key sealed inside the authenticator while only a public key reaches the relying party, retiring the stored shared secret.","How FIDO2 registration keeps the private key sealed inside the authenticator while only a public key reaches the relying party, retiring the stored shared secret.",unique,False,,Brand-consistent (generated featured art),
