url,canonical,title,page_type,indexable,og_image,twitter_image,local_path,img_exists,img_mime,img_w,img_h,img_bytes,og_image_alt,twitter_image_alt,unique_or_shared,is_approved,approved_file,classification,problems
https://ambisecure.ambimat.com/references/x509-oids/,https://ambisecure.ambimat.com/references/x509-oids/,X.509 / Certificate OIDs Reference — AmbiSecure,reference,True,https://ambisecure.ambimat.com/assets/img/og/featured/ambisecure-references-x509-oids-1200x630.png,https://ambisecure.ambimat.com/assets/img/og/featured/ambisecure-references-x509-oids-1200x630.png,assets/img/og/featured/ambisecure-references-x509-oids-1200x630.png,True,image/png,1200,630,47165,"X.509 OID arcs branching into resolved names — RDN types, v3 extensions, signature algorithms and the FIDO AAGUID extension — in AmbiSecure's PKI reference.","X.509 OID arcs branching into resolved names — RDN types, v3 extensions, signature algorithms and the FIDO AAGUID extension — in AmbiSecure's PKI reference.",unique,False,,Brand-consistent (generated featured art),
https://ambisecure.ambimat.com/resources/ambisecure-deck/,https://ambisecure.ambimat.com/resources/ambisecure-deck/,AmbiSecure deck &mdash; hardware-rooted trust platform (slideshow) | AmbiSecure,resource,True,https://ambisecure.ambimat.com/assets/img/og/featured/ambisecure-resources-ambisecure-deck-1200x630.png,https://ambisecure.ambimat.com/assets/img/og/featured/ambisecure-resources-ambisecure-deck-1200x630.png,assets/img/og/featured/ambisecure-resources-ambisecure-deck-1200x630.png,True,image/png,1200,630,49879,"Layered AmbiSecure platform stack — EAL6+ secure element, AmbiSEC module, JavaCard applets, OnePass authenticators — behind a downloadable 20-slide deck.","Layered AmbiSecure platform stack — EAL6+ secure element, AmbiSEC module, JavaCard applets, OnePass authenticators — behind a downloadable 20-slide deck.",unique,False,,Brand-consistent (generated featured art),
https://ambisecure.ambimat.com/resources/,https://ambisecure.ambimat.com/resources/,"Engineering Resources — parsers, references, tools | AmbiSecure",resource,True,https://ambisecure.ambimat.com/assets/img/og/featured/ambisecure-resources-1200x630.png,https://ambisecure.ambimat.com/assets/img/og/featured/ambisecure-resources-1200x630.png,assets/img/og/featured/ambisecure-resources-1200x630.png,True,image/png,1200,630,83127,AmbiSecure engineering tools previewing ATR parsing and APDU/TLV decoding for secure-element and smart-card work.,AmbiSecure engineering tools previewing ATR parsing and APDU/TLV decoding for secure-element and smart-card work.,unique,True,ambisecure-resources-1200x630.png,Approved reference image,
https://ambisecure.ambimat.com/resources/timelines/epassport/,https://ambisecure.ambimat.com/resources/timelines/epassport/,ePassport evolution timeline &mdash; AmbiSecure resources,resource,True,https://ambisecure.ambimat.com/assets/img/og/featured/ambisecure-resources-timelines-epassport-1200x630.png,https://ambisecure.ambimat.com/assets/img/og/featured/ambisecure-resources-timelines-epassport-1200x630.png,assets/img/og/featured/ambisecure-resources-timelines-epassport-1200x630.png,True,image/png,1200,630,43245,"The ePassport chip-to-reader channel hardening from optical MRZ through BAC and PACE to ICAO Digital Travel Credentials, with PKD-distributed trust anchors.","The ePassport chip-to-reader channel hardening from optical MRZ through BAC and PACE to ICAO Digital Travel Credentials, with PKD-distributed trust anchors.",unique,False,,Brand-consistent (generated featured art),
https://ambisecure.ambimat.com/resources/timelines/fido/,https://ambisecure.ambimat.com/resources/timelines/fido/,FIDO evolution timeline &mdash; AmbiSecure resources,resource,True,https://ambisecure.ambimat.com/assets/img/og/featured/ambisecure-resources-timelines-fido-1200x630.png,https://ambisecure.ambimat.com/assets/img/og/featured/ambisecure-resources-timelines-fido-1200x630.png,assets/img/og/featured/ambisecure-resources-timelines-fido-1200x630.png,True,image/png,1200,630,43765,Milestone markers running from the 2012 FIDO Alliance and U2F keys through FIDO2 and CTAP2 to multi-device passkeys and per-credential provenance policy.,Milestone markers running from the 2012 FIDO Alliance and U2F keys through FIDO2 and CTAP2 to multi-device passkeys and per-credential provenance policy.,unique,False,,Brand-consistent (generated featured art),
https://ambisecure.ambimat.com/resources/timelines/,https://ambisecure.ambimat.com/resources/timelines/,Standards evolution timelines &mdash; AmbiSecure resources,resource,True,https://ambisecure.ambimat.com/assets/img/og/featured/ambisecure-resources-timelines-1200x630.png,https://ambisecure.ambimat.com/assets/img/og/featured/ambisecure-resources-timelines-1200x630.png,assets/img/og/featured/ambisecure-resources-timelines-1200x630.png,True,image/png,1200,630,49946,"Seven standards lanes — FIDO, PIV, ePassport, OTP, smart cards, WebAuthn, secure elements — converging on hardware-rooted trust in the AmbiSecure index.","Seven standards lanes — FIDO, PIV, ePassport, OTP, smart cards, WebAuthn, secure elements — converging on hardware-rooted trust in the AmbiSecure index.",unique,False,,Brand-consistent (generated featured art),
https://ambisecure.ambimat.com/resources/timelines/otp-sms/,https://ambisecure.ambimat.com/resources/timelines/otp-sms/,OTP and SMS authentication evolution timeline &mdash; AmbiSecure resources,resource,True,https://ambisecure.ambimat.com/assets/img/og/featured/ambisecure-resources-timelines-otp-sms-1200x630.png,https://ambisecure.ambimat.com/assets/img/og/featured/ambisecure-resources-timelines-otp-sms-1200x630.png,assets/img/og/featured/ambisecure-resources-timelines-otp-sms-1200x630.png,True,image/png,1200,630,37856,"Assurance of shared-secret one-time passwords declining from S/Key and HOTP through SIM-swap and NIST's SMS removal, crossed by the rise of FIDO key pairs.","Assurance of shared-secret one-time passwords declining from S/Key and HOTP through SIM-swap and NIST's SMS removal, crossed by the rise of FIDO key pairs.",unique,False,,Brand-consistent (generated featured art),
https://ambisecure.ambimat.com/resources/timelines/piv/,https://ambisecure.ambimat.com/resources/timelines/piv/,PIV evolution timeline &mdash; AmbiSecure resources,resource,True,https://ambisecure.ambimat.com/assets/img/og/featured/ambisecure-resources-timelines-piv-1200x630.png,https://ambisecure.ambimat.com/assets/img/og/featured/ambisecure-resources-timelines-piv-1200x630.png,assets/img/og/featured/ambisecure-resources-timelines-piv-1200x630.png,True,image/png,1200,630,36768,"A PIV credential shown across card, USB token, phone and nano-card secure element, its SP 800-73 surface unchanged, in the AmbiSecure standards-evolution set.","A PIV credential shown across card, USB token, phone and nano-card secure element, its SP 800-73 surface unchanged, in the AmbiSecure standards-evolution set.",unique,False,,Brand-consistent (generated featured art),
https://ambisecure.ambimat.com/resources/timelines/secure-elements/,https://ambisecure.ambimat.com/resources/timelines/secure-elements/,Secure-element evolution timeline &mdash; AmbiSecure resources,resource,True,https://ambisecure.ambimat.com/assets/img/og/featured/ambisecure-resources-timelines-secure-elements-1200x630.png,https://ambisecure.ambimat.com/assets/img/og/featured/ambisecure-resources-timelines-secure-elements-1200x630.png,assets/img/og/featured/ambisecure-resources-timelines-secure-elements-1200x630.png,True,image/png,1200,630,38441,"One tamper-resistant die migrating from GSM SIM to TPM, embedded SE, eUICC and IoT trust chip, holding key custody constant as only the host changes.","One tamper-resistant die migrating from GSM SIM to TPM, embedded SE, eUICC and IoT trust chip, holding key custody constant as only the host changes.",unique,False,,Brand-consistent (generated featured art),
https://ambisecure.ambimat.com/resources/timelines/smart-cards/,https://ambisecure.ambimat.com/resources/timelines/smart-cards/,Smart-card evolution timeline &mdash; AmbiSecure resources,resource,True,https://ambisecure.ambimat.com/assets/img/og/featured/ambisecure-resources-timelines-smart-cards-1200x630.png,https://ambisecure.ambimat.com/assets/img/og/featured/ambisecure-resources-timelines-smart-cards-1200x630.png,assets/img/og/featured/ambisecure-resources-timelines-smart-cards-1200x630.png,True,image/png,1200,630,39555,A smart-card die evolving from a Moreno memory cell through ISO/IEC 7816 and JavaCard to a JCVM firewall isolating a dozen AID-selectable credential applets.,A smart-card die evolving from a Moreno memory cell through ISO/IEC 7816 and JavaCard to a JCVM firewall isolating a dozen AID-selectable credential applets.,unique,False,,Brand-consistent (generated featured art),
https://ambisecure.ambimat.com/resources/timelines/webauthn-passkey/,https://ambisecure.ambimat.com/resources/timelines/webauthn-passkey/,WebAuthn and passkey evolution timeline &mdash; AmbiSecure resources,resource,True,https://ambisecure.ambimat.com/assets/img/og/featured/ambisecure-resources-timelines-webauthn-passkey-1200x630.png,https://ambisecure.ambimat.com/assets/img/og/featured/ambisecure-resources-timelines-webauthn-passkey-1200x630.png,assets/img/og/featured/ambisecure-resources-timelines-webauthn-passkey-1200x630.png,True,image/png,1200,630,41481,"WebAuthn spec levels stacking from the W3C Credential Management API to synced passkeys and hybrid transport, ending in per-credential provenance policy.","WebAuthn spec levels stacking from the W3C Credential Management API to synced passkeys and hybrid transport, ending in per-credential provenance policy.",unique,False,,Brand-consistent (generated featured art),
https://ambisecure.ambimat.com/resources/tools/aaguid-lookup/,https://ambisecure.ambimat.com/resources/tools/aaguid-lookup/,AAGUID Lookup — AmbiSecure | FIDO2 authenticator directory,resource,True,https://ambisecure.ambimat.com/assets/img/og/featured/ambisecure-resources-tools-aaguid-lookup-1200x630.png,https://ambisecure.ambimat.com/assets/img/og/featured/ambisecure-resources-tools-aaguid-lookup-1200x630.png,assets/img/og/featured/ambisecure-resources-tools-aaguid-lookup-1200x630.png,True,image/png,1200,630,51135,"AmbiSecure AAGUID lookup resolving a 16-byte FIDO2 identifier into a vendor and model card, with the FIDO MDS BLOB marked as the production source.","AmbiSecure AAGUID lookup resolving a 16-byte FIDO2 identifier into a vendor and model card, with the FIDO MDS BLOB marked as the production source.",unique,False,,Brand-consistent (generated featured art),
https://ambisecure.ambimat.com/resources/tools/apdu-builder/,https://ambisecure.ambimat.com/resources/tools/apdu-builder/,APDU Builder — AmbiSecure | ISO 7816-4 command APDU constructor,resource,True,https://ambisecure.ambimat.com/assets/img/og/featured/ambisecure-resources-tools-apdu-builder-1200x630.png,https://ambisecure.ambimat.com/assets/img/og/featured/ambisecure-resources-tools-apdu-builder-1200x630.png,assets/img/og/featured/ambisecure-resources-tools-apdu-builder-1200x630.png,True,image/png,1200,630,55788,"AmbiSecure APDU builder assembling CLA, INS, P1, P2 and data into an ISO/IEC 7816-4 SELECT command, with Lc derived automatically and the case detected locally.","AmbiSecure APDU builder assembling CLA, INS, P1, P2 and data into an ISO/IEC 7816-4 SELECT command, with Lc derived automatically and the case detected locally.",unique,False,,Brand-consistent (generated featured art),
https://ambisecure.ambimat.com/resources/tools/apdu-parser/,https://ambisecure.ambimat.com/resources/tools/apdu-parser/,APDU Parser — ISO 7816-4 command &amp; response | AmbiSecure,resource,True,https://ambisecure.ambimat.com/assets/img/og/featured/ambisecure-resources-tools-apdu-parser-1200x630.png,https://ambisecure.ambimat.com/assets/img/og/featured/ambisecure-resources-tools-apdu-parser-1200x630.png,assets/img/og/featured/ambisecure-resources-tools-apdu-parser-1200x630.png,True,image/png,1200,630,48474,"AmbiSecure APDU parser visual splitting a SELECT command into header, AID data and a 9000 or 6A82 status word returned by the card, all parsed in the browser.","AmbiSecure APDU parser visual splitting a SELECT command into header, AID data and a 9000 or 6A82 status word returned by the card, all parsed in the browser.",unique,False,,Brand-consistent (generated featured art),
https://ambisecure.ambimat.com/resources/tools/apdu-script-validator/,https://ambisecure.ambimat.com/resources/tools/apdu-script-validator/,APDU Script Validator — AmbiSecure | ISO 7816-4 case 1-4,resource,True,https://ambisecure.ambimat.com/assets/img/og/featured/ambisecure-resources-tools-apdu-script-validator-1200x630.png,https://ambisecure.ambimat.com/assets/img/og/featured/ambisecure-resources-tools-apdu-script-validator-1200x630.png,assets/img/og/featured/ambisecure-resources-tools-apdu-script-validator-1200x630.png,True,image/png,1200,630,53393,"A multi-line APDU script checked line by line for ISO 7816-4 case shape, with no card, no reader and no execution behind the AmbiSecure verdicts.","A multi-line APDU script checked line by line for ISO 7816-4 case shape, with no card, no reader and no execution behind the AmbiSecure verdicts.",unique,False,,Brand-consistent (generated featured art),
https://ambisecure.ambimat.com/resources/tools/apdu-status-dict/,https://ambisecure.ambimat.com/resources/tools/apdu-status-dict/,APDU Status Dictionary — AmbiSecure | Full SW1/SW2 reference,resource,True,https://ambisecure.ambimat.com/assets/img/og/featured/ambisecure-resources-tools-apdu-status-dict-1200x630.png,https://ambisecure.ambimat.com/assets/img/og/featured/ambisecure-resources-tools-apdu-status-dict-1200x630.png,assets/img/og/featured/ambisecure-resources-tools-apdu-status-dict-1200x630.png,True,image/png,1200,630,44635,"Filterable status-word reference from AmbiSecure grouping 9XYY successes against 6XYY warnings and errors, with ISO 7816-4, GlobalPlatform, EMV and FIDO sources.","Filterable status-word reference from AmbiSecure grouping 9XYY successes against 6XYY warnings and errors, with ISO 7816-4, GlobalPlatform, EMV and FIDO sources.",unique,False,,Brand-consistent (generated featured art),
https://ambisecure.ambimat.com/resources/tools/ascii-hex/,https://ambisecure.ambimat.com/resources/tools/ascii-hex/,ASCII ↔ HEX Converter — AmbiSecure | Bidirectional ASCII / HEX,resource,True,https://ambisecure.ambimat.com/assets/img/og/featured/ambisecure-resources-tools-ascii-hex-1200x630.png,https://ambisecure.ambimat.com/assets/img/og/featured/ambisecure-resources-tools-ascii-hex-1200x630.png,assets/img/og/featured/ambisecure-resources-tools-ascii-hex-1200x630.png,True,image/png,1200,630,46749,Character-to-byte ribbon showing A and B resolve to 41 42 — the browser-local ASCII/hex view engineers use when reading APDU logs and NDEF payloads.,Character-to-byte ribbon showing A and B resolve to 41 42 — the browser-local ASCII/hex view engineers use when reading APDU logs and NDEF payloads.,unique,False,,Brand-consistent (generated featured art),
https://ambisecure.ambimat.com/resources/tools/asn1-parser/,https://ambisecure.ambimat.com/resources/tools/asn1-parser/,ASN.1 BER/DER Parser — AmbiSecure | Walk any ASN.1 structure,resource,True,https://ambisecure.ambimat.com/assets/img/og/featured/ambisecure-resources-tools-asn1-parser-1200x630.png,https://ambisecure.ambimat.com/assets/img/og/featured/ambisecure-resources-tools-asn1-parser-1200x630.png,assets/img/og/featured/ambisecure-resources-tools-asn1-parser-1200x630.png,True,image/png,1200,630,48277,"AmbiSecure ASN.1 BER/DER parser concept: a PEM block opening into a typed tree of SEQUENCE, INTEGER, OID and OCTET STRING nodes decoded entirely client-side.","AmbiSecure ASN.1 BER/DER parser concept: a PEM block opening into a typed tree of SEQUENCE, INTEGER, OID and OCTET STRING nodes decoded entirely client-side.",unique,False,,Brand-consistent (generated featured art),
https://ambisecure.ambimat.com/resources/tools/asn1-tree-explorer/,https://ambisecure.ambimat.com/resources/tools/asn1-tree-explorer/,ASN.1 Tree Explorer — AmbiSecure | DER walker with collapsible nodes,resource,True,https://ambisecure.ambimat.com/assets/img/og/featured/ambisecure-resources-tools-asn1-tree-explorer-1200x630.png,https://ambisecure.ambimat.com/assets/img/og/featured/ambisecure-resources-tools-asn1-tree-explorer-1200x630.png,assets/img/og/featured/ambisecure-resources-tools-asn1-tree-explorer-1200x630.png,True,image/png,1200,630,44064,"AmbiSecure ASN.1 explorer walking a DER SEQUENCE into named OIDs id-ecPublicKey and prime256v1, accepting PEM and decoding every node in-browser.","AmbiSecure ASN.1 explorer walking a DER SEQUENCE into named OIDs id-ecPublicKey and prime256v1, accepting PEM and decoding every node in-browser.",unique,False,,Brand-consistent (generated featured art),
https://ambisecure.ambimat.com/resources/tools/atr-parser/,https://ambisecure.ambimat.com/resources/tools/atr-parser/,ATR Parser &mdash; decode ISO/IEC 7816-3 Answer-To-Reset,resource,True,https://ambisecure.ambimat.com/assets/img/og/featured/ambisecure-resources-tools-atr-parser-1200x630.png,https://ambisecure.ambimat.com/assets/img/og/featured/ambisecure-resources-tools-atr-parser-1200x630.png,assets/img/og/featured/ambisecure-resources-tools-atr-parser-1200x630.png,True,image/png,1200,630,51299,"AmbiSecure ATR parser diagram showing a smart card emitting TS, T0, TA1, TD1 and historical bytes at reset, decoded in-browser to reveal protocol and timing.","AmbiSecure ATR parser diagram showing a smart card emitting TS, T0, TA1, TD1 and historical bytes at reset, decoded in-browser to reveal protocol and timing.",unique,False,,Brand-consistent (generated featured art),
https://ambisecure.ambimat.com/resources/tools/ats-parser/,https://ambisecure.ambimat.com/resources/tools/ats-parser/,ATS Parser — AmbiSecure | Decode ISO/IEC 14443-4 Answer-To-Select,resource,True,https://ambisecure.ambimat.com/assets/img/og/featured/ambisecure-resources-tools-ats-parser-1200x630.png,https://ambisecure.ambimat.com/assets/img/og/featured/ambisecure-resources-tools-ats-parser-1200x630.png,assets/img/og/featured/ambisecure-resources-tools-ats-parser-1200x630.png,True,image/png,1200,630,52310,"ATS parser concept from AmbiSecure decoding TL, T0, TA(1), TB(1) and TC(1) from a contactless card's answer to RATS, revealing frame size and timing limits.","ATS parser concept from AmbiSecure decoding TL, T0, TA(1), TB(1) and TC(1) from a contactless card's answer to RATS, revealing frame size and timing limits.",unique,False,,Brand-consistent (generated featured art),
https://ambisecure.ambimat.com/resources/tools/attestation-decoder/,https://ambisecure.ambimat.com/resources/tools/attestation-decoder/,WebAuthn Attestation Decoder — AmbiSecure,resource,True,https://ambisecure.ambimat.com/assets/img/og/featured/ambisecure-resources-tools-attestation-decoder-1200x630.png,https://ambisecure.ambimat.com/assets/img/og/featured/ambisecure-resources-tools-attestation-decoder-1200x630.png,assets/img/og/featured/ambisecure-resources-tools-attestation-decoder-1200x630.png,True,image/png,1200,630,49100,"AmbiSecure attestation decoder splitting a CBOR attestationObject into fmt, attStmt and authData, showing how an AAGUID pins an authenticator's make and model.","AmbiSecure attestation decoder splitting a CBOR attestationObject into fmt, attStmt and authData, showing how an AAGUID pins an authenticator's make and model.",unique,False,,Brand-consistent (generated featured art),
https://ambisecure.ambimat.com/resources/tools/authdata-parser/,https://ambisecure.ambimat.com/resources/tools/authdata-parser/,authenticatorData Parser — AmbiSecure | WebAuthn,resource,True,https://ambisecure.ambimat.com/assets/img/og/featured/ambisecure-resources-tools-authdata-parser-1200x630.png,https://ambisecure.ambimat.com/assets/img/og/featured/ambisecure-resources-tools-authdata-parser-1200x630.png,assets/img/og/featured/ambisecure-resources-tools-authdata-parser-1200x630.png,True,image/png,1200,630,53954,"Byte-offset ribbon of WebAuthn authenticatorData in the AmbiSecure parser, exploding the flags byte into UP, UV, BE, BS and AT bits beside signCount.","Byte-offset ribbon of WebAuthn authenticatorData in the AmbiSecure parser, exploding the flags byte into UP, UV, BE, BS and AT bits beside signCount.",unique,False,,Brand-consistent (generated featured art),
https://ambisecure.ambimat.com/resources/tools/base32/,https://ambisecure.ambimat.com/resources/tools/base32/,Base32 Encoder and Decoder — AmbiSecure | RFC 4648 &amp; base32hex,resource,True,https://ambisecure.ambimat.com/assets/img/og/featured/ambisecure-resources-tools-base32-1200x630.png,https://ambisecure.ambimat.com/assets/img/og/featured/ambisecure-resources-tools-base32-1200x630.png,assets/img/og/featured/ambisecure-resources-tools-base32-1200x630.png,True,image/png,1200,630,45502,"An otpauth:// secret expanded to Base32 and split across the A-Z 2-7 rail and the sort-preserving base32hex rail, decoded locally in an AmbiSecure browser tool.","An otpauth:// secret expanded to Base32 and split across the A-Z 2-7 rail and the sort-preserving base32hex rail, decoded locally in an AmbiSecure browser tool.",unique,False,,Brand-consistent (generated featured art),
https://ambisecure.ambimat.com/resources/tools/base64-cert/,https://ambisecure.ambimat.com/resources/tools/base64-cert/,Base64 Certificate Decoder | AmbiSecure,resource,True,https://ambisecure.ambimat.com/assets/img/og/featured/ambisecure-resources-tools-base64-cert-1200x630.png,https://ambisecure.ambimat.com/assets/img/og/featured/ambisecure-resources-tools-base64-cert-1200x630.png,assets/img/og/featured/ambisecure-resources-tools-base64-cert-1200x630.png,True,image/png,1200,630,50299,"A funnel taking PEM, bare base64 and hex blobs down to normalised DER, then re-armouring with the right label — AmbiSecure's local certificate blob decoder.","A funnel taking PEM, bare base64 and hex blobs down to normalised DER, then re-armouring with the right label — AmbiSecure's local certificate blob decoder.",unique,False,,Brand-consistent (generated featured art),
https://ambisecure.ambimat.com/resources/tools/base64/,https://ambisecure.ambimat.com/resources/tools/base64/,Base64 Encoder / Decoder &mdash; standard &amp; URL-safe,resource,True,https://ambisecure.ambimat.com/assets/img/og/featured/ambisecure-resources-tools-base64-1200x630.png,https://ambisecure.ambimat.com/assets/img/og/featured/ambisecure-resources-tools-base64-1200x630.png,assets/img/og/featured/ambisecure-resources-tools-base64-1200x630.png,True,image/png,1200,630,50582,"Two-column comparison of standard base64 against base64url, contrasting their alphabets, padding and RFC 4648 sections.","Two-column comparison of standard base64 against base64url, contrasting their alphabets, padding and RFC 4648 sections.",unique,False,,Brand-consistent (generated featured art),
https://ambisecure.ambimat.com/resources/tools/base64url/,https://ambisecure.ambimat.com/resources/tools/base64url/,Base64URL Converter — AmbiSecure | RFC 4648 §5,resource,True,https://ambisecure.ambimat.com/assets/img/og/featured/ambisecure-resources-tools-base64url-1200x630.png,https://ambisecure.ambimat.com/assets/img/og/featured/ambisecure-resources-tools-base64url-1200x630.png,assets/img/og/featured/ambisecure-resources-tools-base64url-1200x630.png,True,image/png,1200,630,53670,"A WebAuthn credentialId fanned into base64url, base64, hex and UTF-8 lanes, showing the RFC 4648 section 5 alphabet FIDO2 and JOSE use — decoded in the browser.","A WebAuthn credentialId fanned into base64url, base64, hex and UTF-8 lanes, showing the RFC 4648 section 5 alphabet FIDO2 and JOSE use — decoded in the browser.",unique,False,,Brand-consistent (generated featured art),
https://ambisecure.ambimat.com/resources/tools/ber-length/,https://ambisecure.ambimat.com/resources/tools/ber-length/,BER Length Visualizer — AmbiSecure | ITU-T X.690,resource,True,https://ambisecure.ambimat.com/assets/img/og/featured/ambisecure-resources-tools-ber-length-1200x630.png,https://ambisecure.ambimat.com/assets/img/og/featured/ambisecure-resources-tools-ber-length-1200x630.png,assets/img/og/featured/ambisecure-resources-tools-ber-length-1200x630.png,True,image/png,1200,630,47830,"Three BER length forms compared side by side — short, long and indefinite — showing how X.690 encodes any TLV length in one or more octets.","Three BER length forms compared side by side — short, long and indefinite — showing how X.690 encodes any TLV length in one or more octets.",unique,False,,Brand-consistent (generated featured art),
https://ambisecure.ambimat.com/resources/tools/binary-calculator/,https://ambisecure.ambimat.com/resources/tools/binary-calculator/,Binary Calculator — AmbiSecure | bitwise ops &amp; base converter,resource,True,https://ambisecure.ambimat.com/assets/img/og/featured/ambisecure-resources-tools-binary-calculator-1200x630.png,https://ambisecure.ambimat.com/assets/img/og/featured/ambisecure-resources-tools-binary-calculator-1200x630.png,assets/img/og/featured/ambisecure-resources-tools-binary-calculator-1200x630.png,True,image/png,1200,630,50951,"Concept art for the AmbiSecure binary calculator: a value read at once in four bases beside a bitwise panel, with width masking and two's-complement views.","Concept art for the AmbiSecure binary calculator: a value read at once in four bases beside a bitwise panel, with width masking and two's-complement views.",unique,False,,Brand-consistent (generated featured art),
