url,title,image,filename,width,height,alt,classification
https://ambisecure.ambimat.com/resources/tools/tmac-visualizer/,Transaction MAC Field Visualizer — AmbiSecure | DESFire EV2/EV3,https://ambisecure.ambimat.com/assets/img/og/featured/ambisecure-resources-tools-tmac-visualizer-1200x630.png,ambisecure-resources-tools-tmac-visualizer-1200x630.png,1200,630,"The DESFire EV2 Transaction MAC field split into its 4-byte TMC counter and 8-byte TMV, the pair a transit backend reconciles after every commit.",page-specific
https://ambisecure.ambimat.com/resources/tools/uid-analyzer/,UID Analyzer — AmbiSecure,https://ambisecure.ambimat.com/assets/img/og/featured/ambisecure-resources-tools-uid-analyzer-1200x630.png,ambisecure-resources-tools-uid-analyzer-1200x630.png,1200,630,"AmbiSecure UID analyzer visual: an ISO/IEC 14443 Type A card broadcasting 4-, 7- and 10-byte UIDs during anti-collision, with random 0x08 IDs distinguished.",page-specific
https://ambisecure.ambimat.com/resources/tools/url-encoder/,URL Encoder and Decoder — AmbiSecure | percent-encoding tool,https://ambisecure.ambimat.com/assets/img/og/featured/ambisecure-resources-tools-url-encoder-1200x630.png,ambisecure-resources-tools-url-encoder-1200x630.png,1200,630,"A dissected URL bar with delimiters lit, contrasting a query value safely escaped by component encoding against the same value breaking out under encodeURI.",page-specific
https://ambisecure.ambimat.com/resources/tools/utf8/,UTF-8 Inspector — AmbiSecure | Show codepoints &amp; bytes per character,https://ambisecure.ambimat.com/assets/img/og/featured/ambisecure-resources-tools-utf8-1200x630.png,ambisecure-resources-tools-utf8-1200x630.png,1200,630,"Per-character stack showing ASCII at one byte, an accented letter as C3 A9 and an emoji at four bytes, plus a flagged BOM row, inspected locally in the browser.",page-specific
https://ambisecure.ambimat.com/resources/tools/v2x-cert-chain-validator/,V2X Certificate Chain Validator — AmbiSecure,https://ambisecure.ambimat.com/assets/img/og/featured/ambisecure-resources-tools-v2x-cert-chain-validator-1200x630.png,ambisecure-resources-tools-v2x-cert-chain-validator-1200x630.png,1200,630,"Three IEEE 1609.2 certificates stacked as COER blocks, linked upward by HashedId8 digests — AmbiSecure&#x27;s structural check, not signature verification.",page-specific
https://ambisecure.ambimat.com/resources/tools/x509-viewer/,X.509 Certificate Viewer &mdash; decode certs in-browser,https://ambisecure.ambimat.com/assets/img/og/featured/ambisecure-resources-tools-x509-viewer-1200x630.png,ambisecure-resources-tools-x509-viewer-1200x630.png,1200,630,"An X.509 certificate fanned open into subject, validity, key and extension chips in AmbiSecure&#x27;s in-browser viewer — it reads assertions, it does not trust them.",page-specific
https://ambisecure.ambimat.com/resources/tools/xml-formatter/,XML Formatter and Validator — AmbiSecure | pretty-print XML,https://ambisecure.ambimat.com/assets/img/og/featured/ambisecure-resources-tools-xml-formatter-1200x630.png,ambisecure-resources-tools-xml-formatter-1200x630.png,1200,630,"AmbiSecure XML tool concept art: minified markup entering the browser DOMParser, indented output returned, and a DTD external-entity fetch cut off in-browser.",page-specific
https://ambisecure.ambimat.com/resources/webauthn/,WebAuthn Reference — AmbiSecure | Developer documentation portal,https://ambisecure.ambimat.com/assets/img/og/featured/ambisecure-resources-webauthn-1200x630.png,ambisecure-resources-webauthn-1200x630.png,1200,630,"Annotated authenticatorData layout beside the relying-party checks — rpIdHash, flags, attestation — from the AmbiSecure WebAuthn engineering reference portal.",page-specific
https://ambisecure.ambimat.com/search/,"Search AmbiSecure &mdash; products, services, technologies, blog",https://ambisecure.ambimat.com/assets/img/og/search.png,search.png,1200,630,AmbiSecure search title card: client-side search across every modern post and the historical archive.,intentional category image
https://ambisecure.ambimat.com/services/epassport-platform/,AmbiSecure ePassport Platform Engineering &mdash; Backend + PKI,https://ambisecure.ambimat.com/assets/img/og/epassport-platform.png,epassport-platform.png,1200,630,"AmbiSecure title card for ePassport platform engineering: an end-to-end ICAO 9303 platform spanning backend, frontend, CSCA/DSC PKI, enrolment and personalisation.",page-specific
https://ambisecure.ambimat.com/services/fido-validation-server/demo/,FIDO Validation Server demo &mdash; access posture &mdash; AmbiSecure,https://ambisecure.ambimat.com/assets/img/og/featured/ambisecure-services-fido-validation-server-demo-1200x630.png,ambisecure-services-fido-validation-server-demo-1200x630.png,1200,630,Flow diagram showing a validation request sent to the FIDO validation server and returned with a validation result.,page-specific
https://ambisecure.ambimat.com/services/fido-validation-server/,AmbiSecure FIDO Validation Server &mdash; Multi-tenant FIDO2 SaaS,https://ambisecure.ambimat.com/assets/img/og/featured/ambisecure-services-fido-validation-server-1200x630.png,ambisecure-services-fido-validation-server-1200x630.png,1200,630,"AmbiSecure validation server handling attestation, tenant policy and metadata to approve FIDO2 authentication.",page-specific
https://ambisecure.ambimat.com/services/,"Services &mdash; AmbiSecure | JavaCard, FIDO server, personalisation tooling",https://ambisecure.ambimat.com/assets/img/og/featured/ambisecure-services-1200x630.png,ambisecure-services-1200x630.png,1200,630,"AmbiSecure engineering lifecycle from secure silicon through applet development, loading, personalization, form factor and backend validation.",page-specific
https://ambisecure.ambimat.com/services/javacard-development/,JavaCard Applet Development — full-cycle JCOP | AmbiSecure,https://ambisecure.ambimat.com/assets/img/og/featured/ambisecure-services-javacard-development-1200x630.png,ambisecure-services-javacard-development-1200x630.png,1200,630,"Lifecycle diagram for JavaCard Applet Development, following discover to design through ordered stages.",page-specific
https://ambisecure.ambimat.com/services/tool-chain-development/bio-enrollment-app/,Bio Enrollment App — match-on-card biometrics | AmbiSecure,https://ambisecure.ambimat.com/assets/img/og/featured/ambisecure-services-tool-chain-development-bio-enrollment-app-1200x630.png,ambisecure-services-tool-chain-development-bio-enrollment-app-1200x630.png,1200,630,"Lifecycle diagram for Bio Enrollment App, following capture to quality through ordered stages.",page-specific
https://ambisecure.ambimat.com/services/tool-chain-development/,"Tool-Chain Development — bio, key manager, loader | AmbiSecure",https://ambisecure.ambimat.com/assets/img/og/featured/ambisecure-services-tool-chain-development-1200x630.png,ambisecure-services-tool-chain-development-1200x630.png,1200,630,"Lifecycle diagram for Tool-Chain Development, following CAP load to NDEF perso through ordered stages.",page-specific
https://ambisecure.ambimat.com/services/tool-chain-development/multi-card-applet-loader/,Multi-Card Applet Loader — SCP03 CAP loader | AmbiSecure,https://ambisecure.ambimat.com/assets/img/og/featured/ambisecure-services-tool-chain-development-multi-card-applet-loader-1200x630.png,ambisecure-services-tool-chain-development-multi-card-applet-loader-1200x630.png,1200,630,"Lifecycle diagram for Multi-Card Applet Loader, following SCP03 open to LOAD CAP through ordered stages.",page-specific
https://ambisecure.ambimat.com/services/tool-chain-development/ndef-personalisation/,NDEF Personalisation Tool — NFC Forum NDEF | AmbiSecure,https://ambisecure.ambimat.com/assets/img/og/featured/ambisecure-services-tool-chain-development-ndef-personalisation-1200x630.png,ambisecure-services-tool-chain-development-ndef-personalisation-1200x630.png,1200,630,"Lifecycle diagram for NDEF Personalisation Tool, following CSV payload to write NDEF through ordered stages.",page-specific
https://ambisecure.ambimat.com/services/tool-chain-development/security-key-manager/,Security Key Manager — enterprise key lifecycle | AmbiSecure,https://ambisecure.ambimat.com/assets/img/og/featured/ambisecure-services-tool-chain-development-security-key-manager-1200x630.png,ambisecure-services-tool-chain-development-security-key-manager-1200x630.png,1200,630,"Lifecycle diagram for Security Key Manager, following issued to suspended through ordered stages.",page-specific
https://ambisecure.ambimat.com/solutions/closed-loop-ticketing/,Closed-loop ticketing — transit-grade architecture | AmbiSecure,https://ambisecure.ambimat.com/assets/img/og/featured/ambisecure-solutions-closed-loop-ticketing-1200x630.png,ambisecure-solutions-closed-loop-ticketing-1200x630.png,1200,630,"Architecture stack for Closed-loop ticketing — transit-grade architecture, end to end., layered from desfire ev2 / ev3 credentials down to a hardware…",page-specific
https://ambisecure.ambimat.com/solutions/device-identity-at-scale/,"Device Identity at Scale — hardware roots, lifecycle | AmbiSecure",https://ambisecure.ambimat.com/assets/img/og/featured/ambisecure-solutions-device-identity-at-scale-1200x630.png,ambisecure-solutions-device-identity-at-scale-1200x630.png,1200,630,"Architecture stack for Device identity at scale., layered from fleet revocation + ota re-key down to a hardware root of trust.",page-specific
https://ambisecure.ambimat.com/solutions/esim-security/,eSIM Security — AmbiSecure | SGP.22 / SGP.32 / RSP,https://ambisecure.ambimat.com/assets/img/og/featured/ambisecure-solutions-esim-security-1200x630.png,ambisecure-solutions-esim-security-1200x630.png,1200,630,"Architecture stack for eSIM security — SGP.22, GSMA, and what actually deploys., layered from sm-dp+ — operator profiles down to a hardware root of trust.",page-specific
https://ambisecure.ambimat.com/solutions/government-identity/,"Government Identity — high-assurance, attested | AmbiSecure",https://ambisecure.ambimat.com/assets/img/og/featured/ambisecure-solutions-government-identity-1200x630.png,ambisecure-solutions-government-identity-1200x630.png,1200,630,"Architecture stack for Government identity — high-assurance, attestation-anchored., layered from air-gap-tolerant validation down to a hardware root of…",page-specific
https://ambisecure.ambimat.com/solutions/,"Solutions &mdash; passwordless, IoT root of trust, provisioning",https://ambisecure.ambimat.com/assets/img/og/featured/ambisecure-solutions-1200x630.png,ambisecure-solutions-1200x630.png,1200,630,"AmbiSecure hardware root of trust anchoring workforce, connected-device, embedded and PKI solution areas.",page-specific
https://ambisecure.ambimat.com/solutions/javacard-deployment/,JavaCard Applet Deployment — AmbiSecure | Spec to shipment,https://ambisecure.ambimat.com/assets/img/og/featured/ambisecure-solutions-javacard-deployment-1200x630.png,ambisecure-solutions-javacard-deployment-1200x630.png,1200,630,"Architecture stack for JavaCard applet deployment — what actually ships., layered from fido2 · piv · openpgp · emv down to a hardware root of trust.",page-specific
https://ambisecure.ambimat.com/solutions/offline-authentication/,Offline authentication | AmbiSecure,https://ambisecure.ambimat.com/assets/img/og/featured/ambisecure-solutions-offline-authentication-1200x630.png,ambisecure-solutions-offline-authentication-1200x630.png,1200,630,"Architecture stack for Offline authentication — trust without a network., layered from deferred reconciliation down to a hardware root of trust.",page-specific
https://ambisecure.ambimat.com/solutions/passwordless-enterprise/,"Passwordless Enterprise — real, not hidden passwords | AmbiSecure",https://ambisecure.ambimat.com/assets/img/og/featured/ambisecure-solutions-passwordless-enterprise-1200x630.png,ambisecure-solutions-passwordless-enterprise-1200x630.png,1200,630,AmbiSecure hardware authenticator replacing a terminated password path with a device-bound public-key path to enterprise access.,page-specific
https://ambisecure.ambimat.com/solutions/passwordless-mfa/,Passwordless &amp; MFA — hardware-bound enterprise auth | AmbiSecure,https://ambisecure.ambimat.com/assets/img/og/featured/ambisecure-solutions-passwordless-mfa-1200x630.png,ambisecure-solutions-passwordless-mfa-1200x630.png,1200,630,"Architecture stack for Passwordless &amp; MFA — without the OTP fatigue., layered from identity provider — saml/oidc down to a hardware root of trust.",page-specific
https://ambisecure.ambimat.com/solutions/phishing-resistant-authentication/,Phishing-resistant Authentication — AmbiSecure | What it really means,https://ambisecure.ambimat.com/assets/img/og/featured/ambisecure-solutions-phishing-resistant-authentication-1200x630.png,ambisecure-solutions-phishing-resistant-authentication-1200x630.png,1200,630,AmbiSecure authenticator completing authentication only with the legitimate origin while a lookalike origin fails.,page-specific
https://ambisecure.ambimat.com/solutions/secure-element-integration/,Secure Element Integration — AmbiSecure | Silicon-to-cloud,https://ambisecure.ambimat.com/assets/img/og/featured/ambisecure-solutions-secure-element-integration-1200x630.png,ambisecure-solutions-secure-element-integration-1200x630.png,1200,630,AmbiSecure secure element holding keys at the base of a layered stack while verified operations rise to the trusted cloud.,page-specific
https://ambisecure.ambimat.com/solutions/secure-validator-platforms/,Secure validator platforms | AmbiSecure,https://ambisecure.ambimat.com/assets/img/og/featured/ambisecure-solutions-secure-validator-platforms-1200x630.png,ambisecure-solutions-secure-validator-platforms-1200x630.png,1200,630,"Architecture stack for Secure validator platforms., layered from tamper-evident enclosure down to a hardware root of trust.",page-specific
https://ambisecure.ambimat.com/solutions/smart-access-control/,Smart access control | AmbiSecure,https://ambisecure.ambimat.com/assets/img/og/featured/ambisecure-solutions-smart-access-control-1200x630.png,ambisecure-solutions-smart-access-control-1200x630.png,1200,630,"Architecture stack for Smart access control — one credential, every door., layered from doors, laptops, elevators down to a hardware root of trust.",page-specific
https://ambisecure.ambimat.com/solutions/smart-card-personalization/,Smart-Card Personalisation — AmbiSecure | Issuance line,https://ambisecure.ambimat.com/assets/img/og/featured/ambisecure-solutions-smart-card-personalization-1200x630.png,ambisecure-solutions-smart-card-personalization-1200x630.png,1200,630,"Architecture stack for Smart-card personalisation — the line, not just the card., layered from manifest + graded cards out down to a hardware root of…",page-specific
https://ambisecure.ambimat.com/solutions/transit-ticketing/,Transit ticketing — closed-loop deployments | AmbiSecure,https://ambisecure.ambimat.com/assets/img/og/featured/ambisecure-solutions-transit-ticketing-1200x630.png,ambisecure-solutions-transit-ticketing-1200x630.png,1200,630,"Architecture stack for Transit ticketing — the deployment, not the slide., layered from back-office connectors down to a hardware root of trust.",page-specific
https://ambisecure.ambimat.com/solutions/v2x-security/,"V2X Security Architecture — OBU, RSU, and ITS PKI | AmbiSecure",https://ambisecure.ambimat.com/assets/img/og/featured/ambisecure-solutions-v2x-security-1200x630.png,ambisecure-solutions-v2x-security-1200x630.png,1200,630,"AmbiSecure vehicle onboard unit with a secure element exchanging signed, verified V2X messages with a roadside unit and PKI trust service.",page-specific
https://ambisecure.ambimat.com/solutions/workforce-identity/,Workforce Identity — AmbiSecure | Hardware-backed enterprise identity,https://ambisecure.ambimat.com/assets/img/og/featured/ambisecure-solutions-workforce-identity-1200x630.png,ambisecure-solutions-workforce-identity-1200x630.png,1200,630,"Architecture stack for Workforce identity — from day-one to off-boarding., layered from hr system — joiner / leaver down to a hardware root of trust.",page-specific
https://ambisecure.ambimat.com/support/,"Support — AmbiSecure | FAQs, guides, datasheets",https://ambisecure.ambimat.com/assets/img/og/featured/ambisecure-support-1200x630.png,ambisecure-support-1200x630.png,1200,630,"Architecture stack for FAQs, guides, datasheets — and a direct line., layered from direct line into engineering down to a hardware root of trust.",page-specific
https://ambisecure.ambimat.com/tags/aaguid/,"Posts tagged ""AAGUID"" &mdash; AmbiSecure",https://ambisecure.ambimat.com/assets/img/og/featured/ambisecure-tags-aaguid-1200x630.png,ambisecure-tags-aaguid-1200x630.png,1200,630,"AmbiSecure AAGUID index collecting engineering writing on authenticator model id, cose key encoding.",page-specific
https://ambisecure.ambimat.com/tags/ambisec/,"Posts tagged ""AmbiSEC"" &mdash; AmbiSecure",https://ambisecure.ambimat.com/assets/img/og/featured/ambisecure-tags-ambisec-1200x630.png,ambisecure-tags-ambisec-1200x630.png,1200,630,"AmbiSecure AmbiSEC index collecting engineering writing on hardware root of trust, anti-cloning device id.",page-specific
https://ambisecure.ambimat.com/tags/attestation/,"Posts tagged ""Attestation"" &mdash; AmbiSecure",https://ambisecure.ambimat.com/assets/img/og/featured/ambisecure-tags-attestation-1200x630.png,ambisecure-tags-attestation-1200x630.png,1200,630,"AmbiSecure Attestation index collecting engineering writing on statement formats, what to verify.",page-specific
https://ambisecure.ambimat.com/tags/biometrics/,"Posts tagged ""Biometrics"" &mdash; AmbiSecure",https://ambisecure.ambimat.com/assets/img/og/featured/ambisecure-tags-biometrics-1200x630.png,ambisecure-tags-biometrics-1200x630.png,1200,630,"AmbiSecure Biometrics index collecting engineering writing on layering onto existing mfa, workplace face / palm scan.",page-specific
https://ambisecure.ambimat.com/tags/cra/,"Posts tagged ""CRA"" &mdash; AmbiSecure",https://ambisecure.ambimat.com/assets/img/og/featured/ambisecure-tags-cra-1200x630.png,ambisecure-tags-cra-1200x630.png,1200,630,"AmbiSecure CRA index collecting engineering writing on support periods, key rotation, updates.",page-specific
https://ambisecure.ambimat.com/tags/cyber-resilience-act/,"Posts tagged ""Cyber Resilience Act"" &mdash; AmbiSecure",https://ambisecure.ambimat.com/assets/img/og/featured/ambisecure-tags-cyber-resilience-act-1200x630.png,ambisecure-tags-cyber-resilience-act-1200x630.png,1200,630,"AmbiSecure Cyber Resilience Act index collecting engineering writing on digital-element products, 11 sep 2026 reporting.",page-specific
https://ambisecure.ambimat.com/tags/cyber-security/,"Posts tagged ""Cyber Security"" &mdash; AmbiSecure",https://ambisecure.ambimat.com/assets/img/og/featured/ambisecure-tags-cyber-security-1200x630.png,ambisecure-tags-cyber-security-1200x630.png,1200,630,"AmbiSecure Cyber Security index collecting engineering writing on what matters in 2026, cyber attacks in india.",page-specific
https://ambisecure.ambimat.com/tags/desfire/,"Posts tagged ""DESFire"" &mdash; AmbiSecure",https://ambisecure.ambimat.com/assets/img/og/featured/ambisecure-tags-desfire-1200x630.png,ambisecure-tags-desfire-1200x630.png,1200,630,"AmbiSecure DESFire index collecting engineering writing on what changed at each tier, offline fare collection.",page-specific
https://ambisecure.ambimat.com/tags/device-identity/,"Posts tagged ""Device Identity"" &mdash; AmbiSecure",https://ambisecure.ambimat.com/assets/img/og/featured/ambisecure-tags-device-identity-1200x630.png,ambisecure-tags-device-identity-1200x630.png,1200,630,"AmbiSecure Device Identity index collecting engineering writing on secure provisioning, trust anchors.",page-specific
https://ambisecure.ambimat.com/tags/embedded-security/,"Posts tagged ""Embedded Security"" &mdash; AmbiSecure",https://ambisecure.ambimat.com/assets/img/og/featured/ambisecure-tags-embedded-security-1200x630.png,ambisecure-tags-embedded-security-1200x630.png,1200,630,"AmbiSecure Embedded Security index collecting engineering writing on secure key storage, firmware identity.",page-specific
https://ambisecure.ambimat.com/tags/enterprise/,"Posts tagged ""Enterprise"" &mdash; AmbiSecure",https://ambisecure.ambimat.com/assets/img/og/featured/ambisecure-tags-enterprise-1200x630.png,ambisecure-tags-enterprise-1200x630.png,1200,630,"AmbiSecure Enterprise index collecting engineering writing on idp integration, recovery, mixed authenticator fleets.",page-specific
https://ambisecure.ambimat.com/tags/epassport/,"Posts tagged ""ePassport"" &mdash; AmbiSecure",https://ambisecure.ambimat.com/assets/img/og/featured/ambisecure-tags-epassport-1200x630.png,ambisecure-tags-epassport-1200x630.png,1200,630,"AmbiSecure ePassport index collecting engineering writing on chip-based identity, secure element in passport.",page-specific
https://ambisecure.ambimat.com/tags/fido/,"Posts tagged ""FIDO"" &mdash; AmbiSecure",https://ambisecure.ambimat.com/assets/img/og/featured/ambisecure-tags-fido-1200x630.png,ambisecure-tags-fido-1200x630.png,1200,630,"AmbiSecure FIDO index collecting engineering writing on origin binding, where fido2 keys work.",page-specific
https://ambisecure.ambimat.com/tags/government-identity/,"Posts tagged ""Government Identity"" &mdash; AmbiSecure",https://ambisecure.ambimat.com/assets/img/og/featured/ambisecure-tags-government-identity-1200x630.png,ambisecure-tags-government-identity-1200x630.png,1200,630,"AmbiSecure Government Identity index collecting engineering writing on phishing, credential theft, border-control identity.",page-specific
https://ambisecure.ambimat.com/tags/hardware/,"Posts tagged ""Hardware"" &mdash; AmbiSecure",https://ambisecure.ambimat.com/assets/img/og/featured/ambisecure-tags-hardware-1200x630.png,ambisecure-tags-hardware-1200x630.png,1200,630,"AmbiSecure Hardware index collecting engineering writing on secure element / tpm / hsm, key-storage classes.",page-specific
https://ambisecure.ambimat.com/tags/identity/,"Posts tagged ""Identity"" &mdash; AmbiSecure",https://ambisecure.ambimat.com/assets/img/og/featured/ambisecure-tags-identity-1200x630.png,ambisecure-tags-identity-1200x630.png,1200,630,"AmbiSecure Identity index collecting engineering writing on device identity under cra, trust anchors, key storage.",page-specific
https://ambisecure.ambimat.com/tags/,Browse the blog by tag &mdash; AmbiSecure,https://ambisecure.ambimat.com/assets/img/og/featured/ambisecure-tags-1200x630.png,ambisecure-tags-1200x630.png,1200,630,"AmbiSecure Browse the blog by tag. index collecting engineering writing on mfa, fido, passwordless, secure element, desfire.",page-specific
https://ambisecure.ambimat.com/tags/iot-security/,"Posts tagged ""IoT Security"" &mdash; AmbiSecure",https://ambisecure.ambimat.com/assets/img/og/featured/ambisecure-tags-iot-security-1200x630.png,ambisecure-tags-iot-security-1200x630.png,1200,630,"AmbiSecure IoT Security index collecting engineering writing on cra for connected hardware, smart-city hardware.",page-specific
https://ambisecure.ambimat.com/tags/iot/,"Posts tagged ""IoT"" &mdash; AmbiSecure",https://ambisecure.ambimat.com/assets/img/og/featured/ambisecure-tags-iot-1200x630.png,ambisecure-tags-iot-1200x630.png,1200,630,"AmbiSecure IoT index collecting engineering writing on legacy ot trust gaps, signed firmware update.",page-specific
https://ambisecure.ambimat.com/tags/javacard/,"Posts tagged ""JavaCard"" &mdash; AmbiSecure",https://ambisecure.ambimat.com/assets/img/og/featured/ambisecure-tags-javacard-1200x630.png,ambisecure-tags-javacard-1200x630.png,1200,630,"AmbiSecure JavaCard index collecting engineering writing on aid design, lifecycle, secure messaging.",page-specific
https://ambisecure.ambimat.com/tags/mfa/,"Posts tagged ""MFA"" &mdash; AmbiSecure",https://ambisecure.ambimat.com/assets/img/og/featured/ambisecure-tags-mfa-1200x630.png,ambisecure-tags-mfa-1200x630.png,1200,630,"AmbiSecure MFA index collecting engineering writing on what mfa buys you, sim-swap, ss7 relay.",page-specific
https://ambisecure.ambimat.com/tags/passkeys/,"Posts tagged ""Passkeys"" &mdash; AmbiSecure",https://ambisecure.ambimat.com/assets/img/og/featured/ambisecure-tags-passkeys-1200x630.png,ambisecure-tags-passkeys-1200x630.png,1200,630,"AmbiSecure Passkeys index collecting engineering writing on device-bound vs synced, where passkeys replace mfa.",page-specific
https://ambisecure.ambimat.com/tags/passwordless/,"Posts tagged ""Passwordless"" &mdash; AmbiSecure",https://ambisecure.ambimat.com/assets/img/og/featured/ambisecure-tags-passwordless-1200x630.png,ambisecure-tags-passwordless-1200x630.png,1200,630,"AmbiSecure Passwordless index collecting engineering writing on replacing shared secrets, scaling beyond pilots.",page-specific
https://ambisecure.ambimat.com/tags/pki/,"Posts tagged ""PKI"" &mdash; AmbiSecure",https://ambisecure.ambimat.com/assets/img/og/featured/ambisecure-tags-pki-1200x630.png,ambisecure-tags-pki-1200x630.png,1200,630,"AmbiSecure PKI index collecting engineering writing on ra / ca architecture, key custody, attestation.",page-specific
https://ambisecure.ambimat.com/tags/privacy/,"Posts tagged ""Privacy"" &mdash; AmbiSecure",https://ambisecure.ambimat.com/assets/img/og/featured/ambisecure-tags-privacy-1200x630.png,ambisecure-tags-privacy-1200x630.png,1200,630,"AmbiSecure Privacy index collecting engineering writing on consumer biometric rollout, match-on-server tradeoff.",page-specific
