url,title,image,filename,width,height,alt,classification
https://ambisecure.ambimat.com/about/certifications/,Certifications &amp; Standards &mdash; AmbiSecure | Trust documents,https://ambisecure.ambimat.com/assets/img/og/featured/ambisecure-about-certifications-1200x630.png,ambisecure-about-certifications-1200x630.png,1200,630,"Architecture stack for Certifications, standards posture, and trust documents., layered from frameworks — nist, eidas, cra down to a hardware root of…",page-specific
https://ambisecure.ambimat.com/about/,About AmbiSecure &mdash; hardware-rooted security,https://ambisecure.ambimat.com/assets/img/og/featured/ambisecure-about-1200x630.png,ambisecure-about-1200x630.png,1200,630,"AmbiSecure embedded-engineering and secure-element development work grounded in Ahmedabad, India.",page-specific
https://ambisecure.ambimat.com/blog/ambisecure-products-cra-readiness/,AmbiSecure Products &amp; CRA Readiness | AmbiSecure,https://ambisecure.ambimat.com/assets/img/og/featured/ambisecure-blog-ambisecure-products-cra-readiness-1200x630.png,ambisecure-blog-ambisecure-products-cra-readiness-1200x630.png,1200,630,"Mapping table pairing CRA-aligned security needs with AmbiSecure building blocks — AmbiSEC device identity, OnePass credentials and BioKey user authentication.",page-specific
https://ambisecure.ambimat.com/blog/apdu-from-first-principles/,"APDU from First Principles — CLA, INS, P1/P2, SW | AmbiSecure",https://ambisecure.ambimat.com/assets/img/og/featured/ambisecure-blog-apdu-from-first-principles-1200x630.png,ambisecure-blog-apdu-from-first-principles-1200x630.png,1200,630,"Byte-level anatomy of an ISO/IEC 7816-4 command APDU across its four cases, showing how CLA, INS, P1/P2, Lc, Le and SW1/SW2 frame every smart-card exchange.",page-specific
https://ambisecure.ambimat.com/blog/archive/common-misconceptions-about-2fa/,Common Misconceptions About 2FA | AmbiSecure (Archive 2021),https://ambisecure.ambimat.com/assets/img/og/featured/ambisecure-blog-archive-common-misconceptions-about-2fa-1200x630.png,ambisecure-blog-archive-common-misconceptions-about-2fa-1200x630.png,1200,630,"Common second factors tested against phishing and interception, showing why only origin-bound hardware authenticators survive a credential-relay attack.",page-specific
https://ambisecure.ambimat.com/blog/archive/consumer-biometrics-and-privacy/,Consumer Biometrics &amp; Privacy | AmbiSecure (Archive 2020),https://ambisecure.ambimat.com/assets/img/og/featured/ambisecure-blog-archive-consumer-biometrics-and-privacy-1200x630.png,ambisecure-blog-archive-consumer-biometrics-and-privacy-1200x630.png,1200,630,"Two-column comparison of match-on-device against match-on-server, tracing an irreversible template to the secure element where AmbiSecure keeps the comparison.",page-specific
https://ambisecure.ambimat.com/blog/archive/cyber-attacks-in-india-part-1/,Cyber Attacks in India (Archive 2021) — AmbiSecure Blog,https://ambisecure.ambimat.com/assets/img/og/featured/ambisecure-blog-archive-cyber-attacks-in-india-part-1-1200x630.png,ambisecure-blog-archive-cyber-attacks-in-india-part-1-1200x630.png,1200,630,"Landmark Indian banking and identity incidents converging on one shared root: secrets a person could hand over, and access paths that nothing attested.",page-specific
https://ambisecure.ambimat.com/blog/archive/cyber-attacks-in-india-part-2/,Cyber Attacks in India – Part 2 (Archive 2021) — AmbiSecure Blog,https://ambisecure.ambimat.com/assets/img/og/featured/ambisecure-blog-archive-cyber-attacks-in-india-part-2-1200x630.png,ambisecure-blog-archive-cyber-attacks-in-india-part-2-1200x630.png,1200,630,"Five Indian data-exposure incidents drawn as a perimeter row, each mapped to the access control it lacked, from an unsecured SMS server to a third-party KYC warehouse.",page-specific
https://ambisecure.ambimat.com/blog/archive/cyber-attacks-in-india-part-3/,Cyber Attacks in India – Part 3 (Archive 2021) — AmbiSecure Blog,https://ambisecure.ambimat.com/assets/img/og/featured/ambisecure-blog-archive-cyber-attacks-in-india-part-3-1200x630.png,ambisecure-blog-archive-cyber-attacks-in-india-part-3-1200x630.png,1200,630,"Disclosure-lag bars across five Indian consumer-data breaches, tracing the incident-response and credential-hygiene gaps that closed this archive series.",page-specific
https://ambisecure.ambimat.com/blog/archive/emv-certification-in-public-transport/,EMV Certification in Public Transport | AmbiSecure (Archive 2020),https://ambisecure.ambimat.com/assets/img/og/featured/ambisecure-blog-archive-emv-certification-in-public-transport-1200x630.png,ambisecure-blog-archive-emv-certification-in-public-transport-1200x630.png,1200,630,"Certification ladder splitting EMV Level 1 hardware, Level 2 kernel and Level 3 brand testing, with the body that owns each rung in a transit rollout.",page-specific
https://ambisecure.ambimat.com/blog/archive/enterprise-security-threats/,Enterprise Security Threats (Archive 2021) — AmbiSecure Blog,https://ambisecure.ambimat.com/assets/img/og/featured/ambisecure-blog-archive-enterprise-security-threats-1200x630.png,ambisecure-blog-archive-enterprise-security-threats-1200x630.png,1200,630,"The enterprise attack surface widening across cloud, SaaS, contractor, BYOD and IoT entry points, and the credential-controlled wedge hardware-rooted identity narrows.",page-specific
https://ambisecure.ambimat.com/blog/archive/epassport-applications/,ePassport and Its Application (Archive 2021) — AmbiSecure Blog,https://ambisecure.ambimat.com/assets/img/og/featured/ambisecure-blog-archive-epassport-applications-1200x630.png,ambisecure-blog-archive-epassport-applications-1200x630.png,1200,630,"Border-control lane tracing an ICAO 9303 ePassport from airline check-in to eGate, showing why the biometric template stays inside the chip&#x27;s secure element.",page-specific
https://ambisecure.ambimat.com/blog/archive/fast-identity-online/,Fast Identity Online (FIDO) (Archive 2020) — AmbiSecure Blog,https://ambisecure.ambimat.com/assets/img/og/featured/ambisecure-blog-archive-fast-identity-online-1200x630.png,ambisecure-blog-archive-fast-identity-online-1200x630.png,1200,630,"Split diagram contrasting a phishable central secret store with an AmbiSecure authenticator signing an origin-bound challenge, private key never leaving.",page-specific
https://ambisecure.ambimat.com/blog/archive/how-chip-based-epassports-work/,How Chip-Based ePassports Work | AmbiSecure (Archive 2021),https://ambisecure.ambimat.com/assets/img/og/featured/ambisecure-blog-archive-how-chip-based-epassports-work-1200x630.png,ambisecure-blog-archive-how-chip-based-epassports-work-1200x630.png,1200,630,"The contactless inlay inside a biometric passport, with the ICAO 9303 signing chain above it and the PACE-protected read path an inspection system must complete first.",page-specific
https://ambisecure.ambimat.com/blog/archive/,Engineering Archive &mdash; AmbiSecure Blog,https://ambisecure.ambimat.com/assets/img/og/featured/ambisecure-blog-archive-1200x630.png,ambisecure-blog-archive-1200x630.png,1200,630,"Illustration for AmbiSecure engineering writing — 2017 through today., showing 24 entries, 2017 onwards anchored in hardware-rooted security.",page-specific
https://ambisecure.ambimat.com/blog/archive/introduction-to-java-card/,Introduction to Java Card | AmbiSecure (Archive 2020),https://ambisecure.ambimat.com/assets/img/og/featured/ambisecure-blog-archive-introduction-to-java-card-1200x630.png,ambisecure-blog-archive-introduction-to-java-card-1200x630.png,1200,630,"Chip cutaway of the JavaCard runtime and applet firewall, showing how AmbiSecure keeps co-resident FIDO, PIV and ePassport applets isolated on a single die.",page-specific
https://ambisecure.ambimat.com/blog/archive/iot-security-challenges-part-1/,Challenges to IoT Security (Part 1) (Archive 2020) — AmbiSecure Blog,https://ambisecure.ambimat.com/assets/img/og/featured/ambisecure-blog-archive-iot-security-challenges-part-1-1200x630.png,ambisecure-blog-archive-iot-security-challenges-part-1-1200x630.png,1200,630,"One IoT device with its attack surface fanned out — default credentials, stale firmware, plaintext links — and the empty slot where a trust anchor belongs.",page-specific
https://ambisecure.ambimat.com/blog/archive/iot-security-challenges-part-2/,Challenges to IoT Security (Part 2) (Archive 2020) — AmbiSecure Blog,https://ambisecure.ambimat.com/assets/img/og/featured/ambisecure-blog-archive-iot-security-challenges-part-2-1200x630.png,ambisecure-blog-archive-iot-security-challenges-part-2-1200x630.png,1200,630,"Fleet grid where a compromised IoT device stays indistinguishable from its neighbours, mapping the blind spots hardware-rooted identity is meant to narrow.",page-specific
https://ambisecure.ambimat.com/blog/archive/is-passwordless-the-future/,Is Passwordless the future? (Archive 2021) — AmbiSecure Blog,https://ambisecure.ambimat.com/assets/img/og/featured/ambisecure-blog-archive-is-passwordless-the-future-1200x630.png,ambisecure-blog-archive-is-passwordless-the-future-1200x630.png,1200,630,"Architectural contrast between a server holding password hashes worth stealing and one holding only a public key, the shift AmbiSecure&#x27;s FIDO2 hardware makes possible.",page-specific
https://ambisecure.ambimat.com/blog/archive/mfa-in-government/,MFA in Government Sector | AmbiSecure (Archive 2021),https://ambisecure.ambimat.com/assets/img/og/featured/ambisecure-blog-archive-mfa-in-government-1200x630.png,ambisecure-blog-archive-mfa-in-government-1200x630.png,1200,630,"A phishing proxy fronting a government portal, succeeding against a typed SMS code but failing against the origin-bound FIDO2 credential on an AmbiSecure authenticator.",page-specific
https://ambisecure.ambimat.com/blog/archive/public-transport-ticketing-part-1/,Public Transport Ticketing (Part 1) | AmbiSecure (Archive 2020),https://ambisecure.ambimat.com/assets/img/og/featured/ambisecure-blog-archive-public-transport-ticketing-part-1-1200x630.png,ambisecure-blog-archive-public-transport-ticketing-part-1-1200x630.png,1200,630,"Five-column comparison of NCMC, Yikatong, Riyadh, T-money and Suica fare architectures, showing what each Asian network optimised for and where card keys stay.",page-specific
https://ambisecure.ambimat.com/blog/archive/public-transport-ticketing-part-2/,Public Transport Ticketing (Part 2) | AmbiSecure (Archive 2020),https://ambisecure.ambimat.com/assets/img/og/featured/ambisecure-blog-archive-public-transport-ticketing-part-2-1200x630.png,ambisecure-blog-archive-public-transport-ticketing-part-2-1200x630.png,1200,630,"Europe and Latin America fare systems from Oyster to RioCard, showing closed-loop cards and open-loop bank cards converging on a single contactless validator.",page-specific
https://ambisecure.ambimat.com/blog/archive/public-transport-ticketing-part-3/,Public Transport Ticketing (Part 3) | AmbiSecure (Archive 2020),https://ambisecure.ambimat.com/assets/img/og/featured/ambisecure-blog-archive-public-transport-ticketing-part-3-1200x630.png,ambisecure-blog-archive-public-transport-ticketing-part-3-1200x630.png,1200,630,"Hub-and-spoke diagram placing an EZ-Link transit card at the centre, linked to MRT/LRT, bus, taxi and ERP gantry payment points.",page-specific
https://ambisecure.ambimat.com/blog/archive/securing-iiot-infrastructure/,Securing your IIoT infrastructure (Archive 2020) — AmbiSecure Blog,https://ambisecure.ambimat.com/assets/img/og/featured/ambisecure-blog-archive-securing-iiot-infrastructure-1200x630.png,ambisecure-blog-archive-securing-iiot-infrastructure-1200x630.png,1200,630,"Cutaway of a PLC cabinet layering control network out to the IT boundary, showing why AmbiSecure puts device keys in embedded crypto inside the controller.",page-specific
https://ambisecure.ambimat.com/blog/archive/single-sign-on-vs-mfa/,Single Sign-On vs MFA | AmbiSecure (Archive 2021),https://ambisecure.ambimat.com/assets/img/og/featured/ambisecure-blog-archive-single-sign-on-vs-mfa-1200x630.png,ambisecure-blog-archive-single-sign-on-vs-mfa-1200x630.png,1200,630,Two-plane view of an enterprise login: an SSO session carrying identity across apps while an AmbiSecure authenticator supplies the cryptographic proof beneath it.,page-specific
https://ambisecure.ambimat.com/blog/archive/sms-otp-disadvantages/,SMS-Based OTP Disadvantages | AmbiSecure (Archive 2021),https://ambisecure.ambimat.com/assets/img/og/featured/ambisecure-blog-archive-sms-otp-disadvantages-1200x630.png,ambisecure-blog-archive-sms-otp-disadvantages-1200x630.png,1200,630,"The SMS one-time-password delivery path with its SIM-swap, SS7 and relay tap points, set against a FIDO2 exchange that never touches the telecom network.",page-specific
https://ambisecure.ambimat.com/blog/archive/what-is-passwordless-authentication/,What is Passwordless Authentication? (Archive 2021) — AmbiSecure Blog,https://ambisecure.ambimat.com/assets/img/og/featured/ambisecure-blog-archive-what-is-passwordless-authentication-1200x630.png,ambisecure-blog-archive-what-is-passwordless-authentication-1200x630.png,1200,630,"How FIDO2 registration keeps the private key sealed inside the authenticator while only a public key reaches the relying party, retiring the stored shared secret.",page-specific
https://ambisecure.ambimat.com/blog/archive/workplace-biometrics/,Workplace Biometrics — the New Normal | AmbiSecure (Archive 2020),https://ambisecure.ambimat.com/assets/img/og/featured/ambisecure-blog-archive-workplace-biometrics-1200x630.png,ambisecure-blog-archive-workplace-biometrics-1200x630.png,1200,630,"Workplace surfaces mapped to biometric modalities — door, workstation, time-and-attendance — with matching staying on the AmbiSecure card&#x27;s secure element.",page-specific
https://ambisecure.ambimat.com/blog/categories/biometrics/,Biometrics — AmbiSecure Blog,https://ambisecure.ambimat.com/assets/img/og/featured/ambisecure-blog-categories-biometrics-1200x630.png,ambisecure-blog-categories-biometrics-1200x630.png,1200,630,"AmbiSecure Biometrics index collecting engineering writing on face, fingerprint, palm, match-on-device vs server.",page-specific
https://ambisecure.ambimat.com/blog/categories/cryptography/,Cryptography — AmbiSecure Blog,https://ambisecure.ambimat.com/assets/img/og/featured/ambisecure-blog-categories-cryptography-1200x630.png,ambisecure-blog-categories-cryptography-1200x630.png,1200,630,"AmbiSecure Cryptography index collecting engineering writing on aaguid, cose keys, attestation statements.",page-specific
https://ambisecure.ambimat.com/blog/categories/cyber-resilience/,Cyber Resilience — AmbiSecure Blog,https://ambisecure.ambimat.com/assets/img/og/featured/ambisecure-blog-categories-cyber-resilience-1200x630.png,ambisecure-blog-categories-cyber-resilience-1200x630.png,1200,630,"AmbiSecure Cyber Resilience index collecting engineering writing on secure-by-design basics, 2026-2027 deadlines.",page-specific
https://ambisecure.ambimat.com/blog/categories/cyber-threats/,Cyber Threats — AmbiSecure Blog,https://ambisecure.ambimat.com/assets/img/og/featured/ambisecure-blog-categories-cyber-threats-1200x630.png,ambisecure-blog-categories-cyber-threats-1200x630.png,1200,630,"AmbiSecure Cyber Threats index collecting engineering writing on india attack case studies, enterprise attack surface.",page-specific
https://ambisecure.ambimat.com/blog/categories/cybersecurity/,Cybersecurity — AmbiSecure Blog,https://ambisecure.ambimat.com/assets/img/og/featured/ambisecure-blog-categories-cybersecurity-1200x630.png,ambisecure-blog-categories-cybersecurity-1200x630.png,1200,630,"AmbiSecure Cybersecurity index collecting engineering writing on what mfa actually buys you, why mfa is worth friction.",page-specific
https://ambisecure.ambimat.com/blog/categories/desfire/,DESFire — AmbiSecure Blog,https://ambisecure.ambimat.com/assets/img/og/featured/ambisecure-blog-categories-desfire-1200x630.png,ambisecure-blog-categories-desfire-1200x630.png,1200,630,"AmbiSecure DESFire index collecting engineering writing on ev1 / ev2 / ev3 tiers, legacy vs modern rollouts.",page-specific
https://ambisecure.ambimat.com/blog/categories/enterprise-mfa/,Enterprise MFA — AmbiSecure Blog,https://ambisecure.ambimat.com/assets/img/og/featured/ambisecure-blog-categories-enterprise-mfa-1200x630.png,ambisecure-blog-categories-enterprise-mfa-1200x630.png,1200,630,"AmbiSecure Enterprise MFA index collecting engineering writing on passwordless rollout, cloud attack surface.",page-specific
https://ambisecure.ambimat.com/blog/categories/epassport/,ePassport — AmbiSecure Blog,https://ambisecure.ambimat.com/assets/img/og/featured/ambisecure-blog-categories-epassport-1200x630.png,ambisecure-blog-categories-epassport-1200x630.png,1200,630,"AmbiSecure ePassport index collecting engineering writing on bac / pace protocols, csca / dsc / pkd chain.",page-specific
https://ambisecure.ambimat.com/blog/categories/fido/,FIDO — AmbiSecure Blog,https://ambisecure.ambimat.com/assets/img/og/featured/ambisecure-blog-categories-fido-1200x630.png,ambisecure-blog-categories-fido-1200x630.png,1200,630,"AmbiSecure FIDO index collecting engineering writing on registration and auth flow, platform vs roaming keys.",page-specific
https://ambisecure.ambimat.com/blog/categories/government-identity/,Government Identity — AmbiSecure Blog,https://ambisecure.ambimat.com/assets/img/og/featured/ambisecure-blog-categories-government-identity-1200x630.png,ambisecure-blog-categories-government-identity-1200x630.png,1200,630,"AmbiSecure Government Identity index collecting engineering writing on mfa in government sector, chip-based epassports.",page-specific
https://ambisecure.ambimat.com/blog/categories/identity/,Identity — AmbiSecure Blog,https://ambisecure.ambimat.com/assets/img/og/featured/ambisecure-blog-categories-identity-1200x630.png,ambisecure-blog-categories-identity-1200x630.png,1200,630,"AmbiSecure Identity index collecting engineering writing on hardware-bound credentials, attestation, threat models.",page-specific
https://ambisecure.ambimat.com/blog/categories/,Browse by Topic &mdash; AmbiSecure Blog Categories,https://ambisecure.ambimat.com/assets/img/og/featured/ambisecure-blog-categories-1200x630.png,ambisecure-blog-categories-1200x630.png,1200,630,"AmbiSecure Explore the AmbiSecure engineering blog by topic. index collecting engineering writing on fido, mfa, passwordless, smart cards, javacard.",page-specific
https://ambisecure.ambimat.com/blog/categories/iot-security/,IoT Security — AmbiSecure Blog,https://ambisecure.ambimat.com/assets/img/og/featured/ambisecure-blog-categories-iot-security-1200x630.png,ambisecure-blog-categories-iot-security-1200x630.png,1200,630,"AmbiSecure IoT Security index collecting engineering writing on iiot infrastructure trust, device attack surface.",page-specific
https://ambisecure.ambimat.com/blog/categories/javacard/,JavaCard — AmbiSecure Blog,https://ambisecure.ambimat.com/assets/img/og/featured/ambisecure-blog-categories-javacard-1200x630.png,ambisecure-blog-categories-javacard-1200x630.png,1200,630,"AmbiSecure JavaCard index collecting engineering writing on apdu: cla, ins, p1/p2, real desfire examples.",page-specific
https://ambisecure.ambimat.com/blog/categories/mfa/,MFA — AmbiSecure Blog,https://ambisecure.ambimat.com/assets/img/og/featured/ambisecure-blog-categories-mfa-1200x630.png,ambisecure-blog-categories-mfa-1200x630.png,1200,630,"AmbiSecure MFA index collecting engineering writing on passkeys vs classic mfa, sms otp weaknesses.",page-specific
https://ambisecure.ambimat.com/blog/categories/offline-authentication/,Offline Authentication — AmbiSecure Blog,https://ambisecure.ambimat.com/assets/img/og/featured/ambisecure-blog-categories-offline-authentication-1200x630.png,ambisecure-blog-categories-offline-authentication-1200x630.png,1200,630,"AmbiSecure Offline Authentication index collecting engineering writing on low-latency validators, sam-backed attestation.",page-specific
https://ambisecure.ambimat.com/blog/categories/passwordless/,Passwordless — AmbiSecure Blog,https://ambisecure.ambimat.com/assets/img/og/featured/ambisecure-blog-categories-passwordless-1200x630.png,ambisecure-blog-categories-passwordless-1200x630.png,1200,630,"AmbiSecure Passwordless index collecting engineering writing on fido2 developer guide, enterprise rollout, aal3.",page-specific
https://ambisecure.ambimat.com/blog/categories/privacy/,Privacy — AmbiSecure Blog,https://ambisecure.ambimat.com/assets/img/og/featured/ambisecure-blog-categories-privacy-1200x630.png,ambisecure-blog-categories-privacy-1200x630.png,1200,630,"AmbiSecure Privacy index collecting engineering writing on on-device match choice, biometric template storage.",page-specific
https://ambisecure.ambimat.com/blog/categories/smart-cards/,Smart Cards — AmbiSecure Blog,https://ambisecure.ambimat.com/assets/img/og/featured/ambisecure-blog-categories-smart-cards-1200x630.png,ambisecure-blog-categories-smart-cards-1200x630.png,1200,630,"AmbiSecure Smart Cards index collecting engineering writing on iso 7816-4 apdus, desfire, sam, javacard.",page-specific
https://ambisecure.ambimat.com/blog/categories/transit/,Transit — AmbiSecure Blog,https://ambisecure.ambimat.com/assets/img/og/featured/ambisecure-blog-categories-transit-1200x630.png,ambisecure-blog-categories-transit-1200x630.png,1200,630,"AmbiSecure Transit index collecting engineering writing on desfire ev1 / ev2 / ev3, sam-backed offline trust.",page-specific
https://ambisecure.ambimat.com/blog/categories/webauthn/,WebAuthn — AmbiSecure Blog,https://ambisecure.ambimat.com/assets/img/og/featured/ambisecure-blog-categories-webauthn-1200x630.png,ambisecure-blog-categories-webauthn-1200x630.png,1200,630,"AmbiSecure WebAuthn index collecting engineering writing on attestation object bytes, platform vs roaming.",page-specific
https://ambisecure.ambimat.com/blog/cra-secure-by-design-hardware-backed-trust/,CRA Secure by Design: Hardware-Backed Trust | AmbiSecure,https://ambisecure.ambimat.com/assets/img/og/featured/ambisecure-blog-cra-secure-by-design-hardware-backed-trust-1200x630.png,ambisecure-blog-cra-secure-by-design-hardware-backed-trust-1200x630.png,1200,630,"AmbiSEC as the trust layer under a connected node: keys and the update verifier sit below the firmware line, so application code can never read what it protects.",page-specific
https://ambisecure.ambimat.com/blog/cra-vulnerability-handling-product-lifecycle-security/,CRA Vulnerability Handling &amp; Lifecycle | AmbiSecure,https://ambisecure.ambimat.com/assets/img/og/featured/ambisecure-blog-cra-vulnerability-handling-product-lifecycle-security-1200x630.png,ambisecure-blog-cra-vulnerability-handling-product-lifecycle-security-1200x630.png,1200,630,"Staged CRA reporting timeline from awareness to final report, with the support-period rail and the signed update channel a connected product must keep open.",page-specific
https://ambisecure.ambimat.com/blog/credential-lifecycle-management/,Designing Secure Credential Lifecycle Management | AmbiSecure,https://ambisecure.ambimat.com/assets/img/og/featured/ambisecure-blog-credential-lifecycle-management-1200x630.png,ambisecure-blog-credential-lifecycle-management-1200x630.png,1200,630,"Credential state ring from personalisation through enrolment, rotation and revocation, showing where hardware credentials keep keys on-chip across every transition.",page-specific
https://ambisecure.ambimat.com/blog/cyber-security-threats-overview/,Cyber Security Threats &mdash; What Actually Matters in 2026 | AmbiSecure,https://ambisecure.ambimat.com/assets/img/og/featured/ambisecure-blog-cyber-security-threats-overview-1200x630.png,ambisecure-blog-cyber-security-threats-overview-1200x630.png,1200,630,"Threat board pairing AitM phishing, push fatigue, SIM swap and device cloning with the origin-bound, hardware-rooted controls that actually answer each one.",page-specific
https://ambisecure.ambimat.com/blog/desfire-ev1-vs-ev2-vs-ev3/,DESFire EV1 vs EV2 vs EV3 — Architectural Evolution | AmbiSecure,https://ambisecure.ambimat.com/assets/img/og/featured/ambisecure-blog-desfire-ev1-vs-ev2-vs-ev3-1200x630.png,ambisecure-blog-desfire-ev1-vs-ev2-vs-ev3-1200x630.png,1200,630,"Generation ladder across DESFire EV1, EV2 and EV3 — AES-128 stays constant while per-session secure messaging and transaction MAC change what a transit issuer can prove.",page-specific
https://ambisecure.ambimat.com/blog/designing-email-document-signing-platforms/,Designing Secure Email and Document Signing Platforms,https://ambisecure.ambimat.com/assets/img/og/featured/ambisecure-blog-designing-email-document-signing-platforms-1200x630.png,ambisecure-blog-designing-email-document-signing-platforms-1200x630.png,1200,630,"A signature crossing its own certificate&#x27;s expiry and still verifying, because LTV baked the OCSP response and an RFC 3161 timestamp into the CMS bundle at signing time.",page-specific
https://ambisecure.ambimat.com/blog/designing-enterprise-passwordless-systems/,Designing Enterprise Passwordless Systems — the deployment runbook,https://ambisecure.ambimat.com/assets/img/og/featured/ambisecure-blog-designing-enterprise-passwordless-systems-1200x630.png,ambisecure-blog-designing-enterprise-passwordless-systems-1200x630.png,1200,630,"A compact WebAuthn ceremony ringed by the provisioning, validation, federation, recovery and lifecycle machinery a workforce rollout actually runs on.",page-specific
