url,title,image,filename,width,height,alt,classification
https://ambisecure.ambimat.com/blog/designing-low-latency-secure-transit-validators/,Designing Low-Latency Secure Transit Validators | AmbiSecure,https://ambisecure.ambimat.com/assets/img/og/featured/ambisecure-blog-designing-low-latency-secure-transit-validators-1200x630.png,ambisecure-blog-designing-low-latency-secure-transit-validators-1200x630.png,1200,630,"A 300-millisecond tap-to-decision budget split across RF activation, SELECT, EV2 mutual authentication, fare logic and commit, showing a transit validator with no slack left.",page-specific
https://ambisecure.ambimat.com/blog/device-identity-at-manufacturing-scale/,Device Identity at Manufacturing Scale | AmbiSecure,https://ambisecure.ambimat.com/assets/img/og/featured/ambisecure-blog-device-identity-at-manufacturing-scale-1200x630.png,ambisecure-blog-device-identity-at-manufacturing-scale-1200x630.png,1200,630,"Factory-to-field identity: HSM-derived per-device keys land inside secure elements over SCP03, leave an append-only audit trail, then rotate over the air.",page-specific
https://ambisecure.ambimat.com/blog/engineering-epassport-issuance-platforms/,Engineering ePassport Issuance and Identity Platforms,https://ambisecure.ambimat.com/assets/img/og/featured/ambisecure-blog-engineering-epassport-issuance-platforms-1200x630.png,ambisecure-blog-engineering-epassport-issuance-platforms-1200x630.png,1200,630,"The issuing half of an ICAO 9303 passport programme: CSCA signs short-lived DSCs, a DSC signs each SOd, and the PKD publishes the chain for border verifiers.",page-specific
https://ambisecure.ambimat.com/blog/eu-cyber-resilience-act-connected-hardware-iot/,EU Cyber Resilience Act for IoT &amp; Hardware | AmbiSecure,https://ambisecure.ambimat.com/assets/img/og/featured/ambisecure-blog-eu-cyber-resilience-act-connected-hardware-iot-1200x630.png,ambisecure-blog-eu-cyber-resilience-act-connected-hardware-iot-1200x630.png,1200,630,"The CRA calendar for connected hardware: reporting duties from September 2026, manufacturer obligations from December 2027, and the silicon lead times behind both.",page-specific
https://ambisecure.ambimat.com/blog/fido-supported-services/,Where Your AmbiSecure FIDO Key Works | AmbiSecure,https://ambisecure.ambimat.com/assets/img/og/featured/ambisecure-blog-fido-supported-services-1200x630.png,ambisecure-blog-fido-supported-services-1200x630.png,1200,630,"Coverage map fanning an AmbiSecure FIDO2 authenticator through an IdP to the SaaS estate, OS sign-in, and the legacy apps a validation server still has to cover.",page-specific
https://ambisecure.ambimat.com/blog/how-fido-authentication-works/,How FIDO Authentication Works | AmbiSecure,https://ambisecure.ambimat.com/assets/img/og/featured/ambisecure-blog-how-fido-authentication-works-1200x630.png,ambisecure-blog-how-fido-authentication-works-1200x630.png,1200,630,Diagram of an AmbiSecure FIDO2 authenticator signing a challenge bound to example.com while a look-alike domain finds no matching credential and fails.,page-specific
https://ambisecure.ambimat.com/blog/how-v2x-pki-works/,"How V2X PKI Works — EA, AA, pseudonymous certs | AmbiSecure",https://ambisecure.ambimat.com/assets/img/og/featured/ambisecure-blog-how-v2x-pki-works-1200x630.png,ambisecure-blog-how-v2x-pki-works-1200x630.png,1200,630,"The V2X trust fork: an Enrolment Authority and an Authorisation Authority split identity from authorisation so an OBU&#x27;s signed CAM proves hardware, not identity.",page-specific
https://ambisecure.ambimat.com/blog/implementing-fido2-developer-guide/,Implementing FIDO2 — a developer guide | AmbiSecure,https://ambisecure.ambimat.com/assets/img/og/featured/ambisecure-blog-implementing-fido2-developer-guide-1200x630.png,ambisecure-blog-implementing-fido2-developer-guide-1200x630.png,1200,630,"WebAuthn registration end to end: a server challenge, an origin-scoped keypair born inside the authenticator, attestation out, and only the public key stored server-side.",page-specific
https://ambisecure.ambimat.com/blog/,Engineering Blog &mdash; AmbiSecure,https://ambisecure.ambimat.com/assets/img/og/featured/ambisecure-blog-1200x630.png,ambisecure-blog-1200x630.png,1200,630,"Wayfinding plate for the AmbiSecure engineering blog, grouping its clusters — FIDO, JavaCard and APDU, DESFire transit, V2X and secure-element work — into five topic tiles.",page-specific
https://ambisecure.ambimat.com/blog/javacard-applet-development-enterprise-identity/,JavaCard Applet Development for Enterprise Identity | AmbiSecure,https://ambisecure.ambimat.com/assets/img/og/featured/ambisecure-blog-javacard-applet-development-enterprise-identity-1200x630.png,ambisecure-blog-javacard-applet-development-enterprise-identity-1200x630.png,1200,630,"JavaCard applet path from CAP file through GlobalPlatform load and install to SCP03 personalisation and lock, with AID selection over the APDU interface.",page-specific
https://ambisecure.ambimat.com/blog/lava-lamps-and-cryptographic-entropy/,Lava Lamps and Cryptographic Entropy | AmbiSecure,https://ambisecure.ambimat.com/assets/img/og/featured/ambisecure-blog-lava-lamps-and-cryptographic-entropy-1200x630.png,ambisecure-blog-lava-lamps-and-cryptographic-entropy-1200x630.png,1200,630,"Cloudflare&#x27;s lava-lamp wall and a secure element&#x27;s on-chip thermal TRNG follow the same pipeline shape: physical noise, hashing, then a seeded CSPRNG.",page-specific
https://ambisecure.ambimat.com/blog/page/2/,Engineering blog &mdash; page 2 &mdash; AmbiSecure,https://ambisecure.ambimat.com/assets/img/og/blog.png,blog.png,1200,630,"AmbiSecure engineering blog title card: practical, code-first writing on hardware-rooted security.",intentional category image
https://ambisecure.ambimat.com/blog/passkeys-vs-traditional-mfa/,Passkeys vs Traditional MFA — what really changed,https://ambisecure.ambimat.com/assets/img/og/featured/ambisecure-blog-passkeys-vs-traditional-mfa-1200x630.png,ambisecure-blog-passkeys-vs-traditional-mfa-1200x630.png,1200,630,Why an adversary-in-the-middle proxy replays a one-time code but cannot use a passkey: the assertion is bound to the relying-party origin it never matches.,page-specific
https://ambisecure.ambimat.com/blog/piv-vs-usb-tokens-vs-embedded/,PIV Smart Cards vs USB Tokens vs Embedded Secure Elements,https://ambisecure.ambimat.com/assets/img/og/featured/ambisecure-blog-piv-vs-usb-tokens-vs-embedded-1200x630.png,ambisecure-blog-piv-vs-usb-tokens-vs-embedded-1200x630.png,1200,630,"PIV card, USB token and soldered secure element compared on lifecycle — issuance CA, help-desk setup, or MDM channel — since all three seal the workforce private key equally.",page-specific
https://ambisecure.ambimat.com/blog/pki-credential-issuance-workforce-government/,"PKI Credential Issuance — workforce, government | AmbiSecure",https://ambisecure.ambimat.com/assets/img/og/featured/ambisecure-blog-pki-credential-issuance-workforce-government-1200x630.png,ambisecure-blog-pki-credential-issuance-workforce-government-1200x630.png,1200,630,"Two-tier PKI issuance architecture with an offline root, HSM-backed issuing CA, and an RA gate that checks hardware attestation before any certificate is signed.",page-specific
https://ambisecure.ambimat.com/blog/platform-vs-roaming-authenticators/,Platform vs Roaming Authenticators — picking the right form factor,https://ambisecure.ambimat.com/assets/img/og/featured/ambisecure-blog-platform-vs-roaming-authenticators-1200x630.png,ambisecure-blog-platform-vs-roaming-authenticators-1200x630.png,1200,630,"Platform authenticators bound to one host versus roaming OnePass cards and keys that travel, with the phone reaching hosts over WebAuthn hybrid transport.",page-specific
https://ambisecure.ambimat.com/blog/pseudonymous-certificates-and-privacy/,Pseudonymous Certificates and Privacy in V2X | AmbiSecure,https://ambisecure.ambimat.com/assets/img/og/featured/ambisecure-blog-pseudonymous-certificates-and-privacy-1200x630.png,ambisecure-blog-pseudonymous-certificates-and-privacy-1200x630.png,1200,630,V2X privacy flow: an enrolment credential stays sealed in the secure element while rotating pseudonymous certificates sign messages carrying no device identifier.,page-specific
https://ambisecure.ambimat.com/blog/secure-element-vs-tpm-vs-hsm/,Secure Element vs TPM vs HSM — Where Each Fits | AmbiSecure,https://ambisecure.ambimat.com/assets/img/og/featured/ambisecure-blog-secure-element-vs-tpm-vs-hsm-1200x630.png,ambisecure-blog-secure-element-vs-tpm-vs-hsm-1200x630.png,1200,630,"Three-zone diagram siting a secure element in a device, a TPM on a motherboard and an HSM in a rack, showing why key location decides the hardware class.",page-specific
https://ambisecure.ambimat.com/blog/secure-elements-in-connected-vehicles/,Secure Elements in Connected Vehicles | AmbiSecure,https://ambisecure.ambimat.com/assets/img/og/featured/ambisecure-blog-secure-elements-in-connected-vehicles-1200x630.png,ambisecure-blog-secure-elements-in-connected-vehicles-1200x630.png,1200,630,"Cutaway of a tamper-resistant secure element inside a V2X on-board unit, showing key custody that stays on-chip while the host MCU only passes commands.",page-specific
https://ambisecure.ambimat.com/blog/secure-iot-identity-with-applets/,Building Secure IoT Identity with Security Applets,https://ambisecure.ambimat.com/assets/img/og/featured/ambisecure-blog-secure-iot-identity-with-applets-1200x630.png,ambisecure-blog-secure-iot-identity-with-applets-1200x630.png,1200,630,Five AmbiSecure JavaCard applets inside a secure-element boundary — provisioning to key rotation — with only commands and public keys crossing to the host MCU.,page-specific
https://ambisecure.ambimat.com/blog/sim-based-fido2-authenticators/,Embedded Secure-Element FIDO2 Authenticators for Enterprise Identity,https://ambisecure.ambimat.com/assets/img/og/featured/ambisecure-blog-sim-based-fido2-authenticators-1200x630.png,ambisecure-blog-sim-based-fido2-authenticators-1200x630.png,1200,630,One CC EAL6+ secure element in two packages — removable 4FF nano-card and solderable MFF2 — running a FIDO2 applet whose P-256 private key never leaves the chip boundary.,page-specific
https://ambisecure.ambimat.com/blog/smart-cards-vs-fido-tokens-vs-passkeys/,Smart Cards vs FIDO Tokens vs Passkeys | AmbiSecure,https://ambisecure.ambimat.com/assets/img/og/featured/ambisecure-blog-smart-cards-vs-fido-tokens-vs-passkeys-1200x630.png,ambisecure-blog-smart-cards-vs-fido-tokens-vs-passkeys-1200x630.png,1200,630,"Comparison of smart-card, FIDO security-key and synced-passkey credentials across extraction, loss recovery and attestation, all origin-bound at the relying party.",page-specific
https://ambisecure.ambimat.com/blog/top-3-benefits-of-mfa/,Top 3 Benefits of Multi-factor Authentication | AmbiSecure,https://ambisecure.ambimat.com/assets/img/og/featured/ambisecure-blog-top-3-benefits-of-mfa-1200x630.png,ambisecure-blog-top-3-benefits-of-mfa-1200x630.png,1200,630,"Matrix scoring password-only, OTP and hardware-bound MFA against credential stuffing, phishing blast radius and audit evidence, with AAGUID attestation as the audit lever.",page-specific
https://ambisecure.ambimat.com/blog/transit-validators-offline-trust-architecture/,Why Transit Validators Need Offline Trust Architecture | AmbiSecure,https://ambisecure.ambimat.com/assets/img/og/featured/ambisecure-blog-transit-validators-offline-trust-architecture-1200x630.png,ambisecure-blog-transit-validators-offline-trust-architecture-1200x630.png,1200,630,"Transit validator cutaway where a SAM derives per-card keys and completes DESFire mutual authentication offline, journaling each tap for later reconciliation.",page-specific
https://ambisecure.ambimat.com/blog/understanding-webauthn-attestation-objects/,Understanding WebAuthn Attestation Objects | AmbiSecure,https://ambisecure.ambimat.com/assets/img/og/featured/ambisecure-blog-understanding-webauthn-attestation-objects-1200x630.png,ambisecure-blog-understanding-webauthn-attestation-objects-1200x630.png,1200,630,"WebAuthn attestationObject unpacked into fmt, attStmt and authData, its x5c chain validating to the manufacturer root that a cached FIDO MDS BLOB names for that AAGUID.",page-specific
https://ambisecure.ambimat.com/blog/why-hardware-backed-identity-matters/,Why Hardware-Backed Identity Matters — the cost-per-extraction frame,https://ambisecure.ambimat.com/assets/img/og/featured/ambisecure-blog-why-hardware-backed-identity-matters-1200x630.png,ambisecure-blog-why-hardware-backed-identity-matters-1200x630.png,1200,630,"A logarithmic ladder of what stealing one credential costs an attacker, from a $5 phishing kit to millions against a CC EAL6+ secure element boundary.",page-specific
https://ambisecure.ambimat.com/blog/why-sams-matter-in-closed-loop-transit/,Why SAMs Matter in Closed-Loop Transit Systems | AmbiSecure,https://ambisecure.ambimat.com/assets/img/og/featured/ambisecure-blog-why-sams-matter-in-closed-loop-transit-1200x630.png,ambisecure-blog-why-sams-matter-in-closed-loop-transit-1200x630.png,1200,630,"Transit key hierarchy running from the issuer&#x27;s HSM down to a per-tap session key, with K_app sealed inside the validator&#x27;s Secure Access Module and never on the reader CPU.",page-specific
https://ambisecure.ambimat.com/blog/why-software-only-device-trust-fails/,Why Software-Only Device Trust Fails | AmbiSecure,https://ambisecure.ambimat.com/assets/img/og/featured/ambisecure-blog-why-software-only-device-trust-fails-1200x630.png,ambisecure-blog-why-software-only-device-trust-fails-1200x630.png,1200,630,"A field device teardown showing why firmware-stored keys fall: exposed debug pads, an external SPI flash under a clip, and one extraction cloning a whole fleet.",page-specific
https://ambisecure.ambimat.com/blog/why-use-multi-factor-authentication/,Why use Multi-factor Authentication? | AmbiSecure,https://ambisecure.ambimat.com/assets/img/og/featured/ambisecure-blog-why-use-multi-factor-authentication-1200x630.png,ambisecure-blog-why-use-multi-factor-authentication-1200x630.png,1200,630,"Credential-stuffing funnel showing why a password gate falls open, an OTP gate only raises attacker cost, and an origin-bound hardware factor blocks credential reuse outright.",page-specific
https://ambisecure.ambimat.com/brochures/device-identity/,Device identity / IoT brochure &mdash; AmbiSecure,https://ambisecure.ambimat.com/assets/img/og/featured/ambisecure-brochures-device-identity-1200x630.png,ambisecure-brochures-device-identity-1200x630.png,1200,630,AmbiSecure Hardware-rooted identity on the BOM. presented as a lookup table of Secure element on board and related entries for engineering reference.,page-specific
https://ambisecure.ambimat.com/brochures/fido/,FIDO deployment brochure &mdash; AmbiSecure,https://ambisecure.ambimat.com/assets/img/og/featured/ambisecure-brochures-fido-1200x630.png,ambisecure-brochures-fido-1200x630.png,1200,630,"AmbiSecure Phishing-resistant authentication, deployed. presented as a lookup table of Private key in the SE and related entries for engineering reference.",page-specific
https://ambisecure.ambimat.com/brochures/,Brochures &mdash; AmbiSecure,https://ambisecure.ambimat.com/assets/img/og/featured/ambisecure-brochures-1200x630.png,ambisecure-brochures-1200x630.png,1200,630,"AmbiSecure branded technical document covers for product, solution and architecture briefs.",page-specific
https://ambisecure.ambimat.com/brochures/javacard/,JavaCard platform brochure &mdash; AmbiSecure,https://ambisecure.ambimat.com/assets/img/og/featured/ambisecure-brochures-javacard-1200x630.png,ambisecure-brochures-javacard-1200x630.png,1200,630,"AmbiSecure Twelve applets, one chip, AID-selectable. presented as a lookup table of WebAuthn / CTAP2 auth and related entries for engineering reference.",page-specific
https://ambisecure.ambimat.com/brochures/onepass/,OnePass platform brochure &mdash; AmbiSecure,https://ambisecure.ambimat.com/assets/img/og/featured/ambisecure-brochures-onepass-1200x630.png,ambisecure-brochures-onepass-1200x630.png,1200,630,"AmbiSecure OnePass — one identity, every form factor. presented as a lookup table of Smart card + FIDO2 + NFC and related entries for engineering…",page-specific
https://ambisecure.ambimat.com/brochures/pki/,PKI &amp; credential lifecycle brochure &mdash; AmbiSecure,https://ambisecure.ambimat.com/assets/img/og/featured/ambisecure-brochures-pki-1200x630.png,ambisecure-brochures-pki-1200x630.png,1200,630,"AmbiSecure X.509 issuance from workforce to government scale. presented as a lookup table of Signs; key in HSM, M-of-N and related entries for…",page-specific
https://ambisecure.ambimat.com/brochures/transit-security/,Transit security brochure &mdash; AmbiSecure,https://ambisecure.ambimat.com/assets/img/og/featured/ambisecure-brochures-transit-security-1200x630.png,ambisecure-brochures-transit-security-1200x630.png,1200,630,"AmbiSecure Closed-loop transit ticketing, designed offline-first. presented as a lookup table of DESFire EV2/EV3, AES-128 and related entries for…",page-specific
https://ambisecure.ambimat.com/case-studies/,Case studies &mdash; AmbiSecure,https://ambisecure.ambimat.com/assets/img/og/featured/ambisecure-case-studies-1200x630.png,ambisecure-case-studies-1200x630.png,1200,630,AmbiSecure deployment journey from architecture through prototype and personalization to field deployment.,page-specific
https://ambisecure.ambimat.com/case-studies/passwordless-workforce/,Passwordless workforce authentication &mdash; AmbiSecure case study,https://ambisecure.ambimat.com/assets/img/og/featured/ambisecure-case-studies-passwordless-workforce-1200x630.png,ambisecure-case-studies-passwordless-workforce-1200x630.png,1200,630,"Architecture stack for Phasing out SMS and TOTP across a mixed enterprise estate., layered from okta · entra id · legacy cas down to a hardware root of…",page-specific
https://ambisecure.ambimat.com/case-studies/secure-device-identity/,Secure device identity for IoT &mdash; AmbiSecure case study,https://ambisecure.ambimat.com/assets/img/og/featured/ambisecure-case-studies-secure-device-identity-1200x630.png,ambisecure-case-studies-secure-device-identity-1200x630.png,1200,630,"Architecture stack for Putting hardware-rooted identity on a connected-device line at the SMT stage., layered from device-to-cloud attestation down to…",page-specific
https://ambisecure.ambimat.com/case-studies/transit-ticketing/,Closed-loop transit ticketing &mdash; AmbiSecure case study,https://ambisecure.ambimat.com/assets/img/og/featured/ambisecure-case-studies-transit-ticketing-1200x630.png,ambisecure-case-studies-transit-ticketing-1200x630.png,1200,630,"Architecture stack for Sub-300 ms validators, offline trust, and a backend that can be down., layered from reconciliation + revocation down to a…",page-specific
https://ambisecure.ambimat.com/contact/,"Contact AmbiSecure — Talk to engineers, not BDRs",https://ambisecure.ambimat.com/assets/img/og/featured/ambisecure-contact-1200x630.png,ambisecure-contact-1200x630.png,1200,630,"Architecture stack for Talk to engineers, not BDRs., layered from phone — india +91 / us +1 down to a hardware root of trust.",page-specific
https://ambisecure.ambimat.com/engagement-models/,Engagement models &mdash; AmbiSecure,https://ambisecure.ambimat.com/assets/img/og/featured/ambisecure-engagement-models-1200x630.png,ambisecure-engagement-models-1200x630.png,1200,630,"Architecture stack for How AmbiSecure engagements work., layered from architecture review down to a hardware root of trust.",page-specific
https://ambisecure.ambimat.com/faqs/,"AmbiSecure FAQs &mdash; FIDO, PIV, JavaCard, secure elements",https://ambisecure.ambimat.com/assets/img/og/featured/ambisecure-faqs-1200x630.png,ambisecure-faqs-1200x630.png,1200,630,"Architecture stack for AmbiSecure FAQs — answers from engineering, not marketing, layered from answers from engineering down to a hardware root of trust.",page-specific
https://ambisecure.ambimat.com/,"AmbiSecure — Hardware-rooted identity: FIDO, JavaCard, V2X PKI",https://ambisecure.ambimat.com/assets/img/og/featured/ambisecure-home-1200x630.png,ambisecure-home-1200x630.png,1200,630,"AmbiSecure secure-element hub linking smart card, USB key, IoT device, vehicle, government credential and cloud app through a hardware-rooted trust chain.",page-specific
https://ambisecure.ambimat.com/industries/connected-mobility/,Connected Mobility &amp; V2X Security | AmbiSecure,https://ambisecure.ambimat.com/assets/img/og/featured/ambisecure-industries-connected-mobility-1200x630.png,ambisecure-industries-connected-mobility-1200x630.png,1200,630,AmbiSecure connected vehicle with an embedded identity anchor exchanging signed messages and managed certificates.,page-specific
https://ambisecure.ambimat.com/industries/enterprise-access/,"Enterprise access — AmbiSecure | One credential, every door",https://ambisecure.ambimat.com/assets/img/og/featured/ambisecure-industries-enterprise-access-1200x630.png,ambisecure-industries-enterprise-access-1200x630.png,1200,630,"AmbiSecure single hardware credential opening building access, workstation login, VPN or cloud and privileged systems.",page-specific
https://ambisecure.ambimat.com/industries/government-and-defence/,"Government &amp; Defence — PIV, eID, civil-servant auth | AmbiSecure",https://ambisecure.ambimat.com/assets/img/og/featured/ambisecure-industries-government-and-defence-1200x630.png,ambisecure-industries-government-and-defence-1200x630.png,1200,630,"AmbiSecure PIV-style credential linking controlled issuance, a government workstation and a PKI trust hierarchy.",page-specific
https://ambisecure.ambimat.com/industries/,"Industries — BFSI, Government, Telecom, IoT, Transit | AmbiSecure",https://ambisecure.ambimat.com/assets/img/og/featured/ambisecure-industries-1200x630.png,ambisecure-industries-1200x630.png,1200,630,"AmbiSecure root of trust anchoring government, enterprise, transit, smart-city and IoT deployments.",page-specific
https://ambisecure.ambimat.com/industries/smart-cities/,Smart cities — multi-application credentials at scale | AmbiSecure,https://ambisecure.ambimat.com/assets/img/og/featured/ambisecure-industries-smart-cities-1200x630.png,ambisecure-industries-smart-cities-1200x630.png,1200,630,"AmbiSecure city credential connecting transit, civic access, utility and digital public services from one secure core.",page-specific
https://ambisecure.ambimat.com/industries/transportation/,Transportation — Transit ticketing &amp; validator platforms | AmbiSecure,https://ambisecure.ambimat.com/assets/img/og/featured/ambisecure-industries-transportation-1200x630.png,ambisecure-industries-transportation-1200x630.png,1200,630,AmbiSecure transit card tapping a validator connected to a protected secure backend for closed-loop ticketing.,page-specific
https://ambisecure.ambimat.com/partners/,"Partners &mdash; AmbiSecure | Resellers, OEMs, system integrators, MSSPs",https://ambisecure.ambimat.com/assets/img/og/featured/ambisecure-partners-1200x630.png,ambisecure-partners-1200x630.png,1200,630,"Architecture stack for Partner with AmbiSecure., layered from resellers · oems · sis · mssps down to a hardware root of trust.",page-specific
https://ambisecure.ambimat.com/privacy/,Privacy &amp; analytics preferences &mdash; AmbiSecure,https://ambisecure.ambimat.com/assets/img/og/featured/ambisecure-privacy-1200x630.png,ambisecure-privacy-1200x630.png,1200,630,"Architecture stack for Your data, your choice., layered from dnt: 1 — honoured by default down to a hardware root of trust.",page-specific
https://ambisecure.ambimat.com/products/biokey-on-device-totp/,BioKey On-Device TOTP &mdash; Hardware-Sealed OTP | AmbiSecure,https://ambisecure.ambimat.com/assets/img/og/featured/ambisecure-products-biokey-on-device-totp-1200x630.png,ambisecure-products-biokey-on-device-totp-1200x630.png,1200,630,"AmbiSecure BioKey adds on-device TOTP shown as hardware with usb key · fido2 + oath totp, keys held in the secure element.",page-specific
https://ambisecure.ambimat.com/products/biokey/,AmbiSecure BioKey &mdash; Biometric USB Security Key | AmbiSecure,https://ambisecure.ambimat.com/assets/img/og/featured/ambisecure-products-biokey-1200x630.png,ambisecure-products-biokey-1200x630.png,1200,630,AmbiSecure BioKey verifying a fingerprint on the hardware security key itself before completing FIDO authentication.,page-specific
https://ambisecure.ambimat.com/products/digital-signature-token/,Digital Signature Token &mdash; hardware PKI token,https://ambisecure.ambimat.com/assets/img/og/featured/ambisecure-products-digital-signature-token-1200x630.png,ambisecure-products-digital-signature-token-1200x630.png,1200,630,"AmbiSecure AmbiSecure Digital Signature Token shown as hardware with usb-a token · 40 × 12 mm, keys held in the secure element.",page-specific
https://ambisecure.ambimat.com/products/esim-solution/,AmbiSecure eSIM — SGP.22 / SGP.32 eUICC + OIDC | AmbiSecure,https://ambisecure.ambimat.com/assets/img/og/featured/ambisecure-products-esim-solution-1200x630.png,ambisecure-products-esim-solution-1200x630.png,1200,630,"AmbiSecure AmbiSecure eSIM Solution shown as hardware with euicc · consumer, m2m, auto, keys held in the secure element.",page-specific
https://ambisecure.ambimat.com/products/fido2-nano-sim-applet/,FIDO2 Nano-Card Applet — embedded SE authenticator | AmbiSecure,https://ambisecure.ambimat.com/assets/img/og/fido2-nano-sim-applet.png,fido2-nano-sim-applet.png,1200,630,AmbiSecure title card for the FIDO2 applet on a nano SIM: a hardware-backed FIDO2 credential held inside a 4FF SIM secure element.,page-specific
