url,title,image,filename,width,height,alt,classification
https://ambisecure.ambimat.com/products/,"Products &mdash; FIDO, JavaCard &amp; IoT SE | AmbiSecure",https://ambisecure.ambimat.com/assets/img/og/featured/ambisecure-products-1200x630.png,ambisecure-products-1200x630.png,1200,630,"AmbiSecure product family - smart card, USB key, tappable NFC, embedded secure element and JavaCard - arranged around one shared identity core.",page-specific
https://ambisecure.ambimat.com/products/iot-security-applets/,AmbiSecure IoT Security Applets &mdash; Secure-Element Applets,https://ambisecure.ambimat.com/assets/img/og/iot-security-applets.png,iot-security-applets.png,1200,630,"AmbiSecure title card for IoT Security Applets, listing five applets for device identity: provisioning, attestation, mTLS, signed update and key rotation.",page-specific
https://ambisecure.ambimat.com/products/iot-security-coprocessor/,AmbiSEC IoT Security Co-Processor — dual-domain SE | AmbiSecure,https://ambisecure.ambimat.com/assets/img/og/featured/ambisecure-products-iot-security-coprocessor-1200x630.png,ambisecure-products-iot-security-coprocessor-1200x630.png,1200,630,AmbiSecure IoT security co-processor isolating device keys in a secure element separate from the application MCU.,page-specific
https://ambisecure.ambimat.com/products/iot-solution/,AmbiSecure IoT Solution — end-to-end platform | AmbiSecure,https://ambisecure.ambimat.com/assets/img/og/featured/ambisecure-products-iot-solution-1200x630.png,ambisecure-products-iot-solution-1200x630.png,1200,630,"AmbiSecure AmbiSecure IoT Solution shown as hardware with iot security co-processor, keys held in the secure element.",page-specific
https://ambisecure.ambimat.com/products/javacard-applets/,"JavaCard Applets — FIDO, PIV, OpenPGP, NDEF | AmbiSecure",https://ambisecure.ambimat.com/assets/img/og/featured/ambisecure-products-javacard-applets-1200x630.png,ambisecure-products-javacard-applets-1200x630.png,1200,630,"AmbiSecure JavaCard platform loading FIDO, PIV, OpenPGP and NDEF applets onto a tamper-resistant secure element.",page-specific
https://ambisecure.ambimat.com/products/onepass-bio-card/,OnePass Bio Card &mdash; biometric FIDO2 smart card,https://ambisecure.ambimat.com/assets/img/og/featured/ambisecure-products-onepass-bio-card-1200x630.png,ambisecure-products-onepass-bio-card-1200x630.png,1200,630,"AmbiSecure OnePass Bio Card capturing, storing and matching a fingerprint entirely on the card before authentication.",page-specific
https://ambisecure.ambimat.com/products/onepass-card/,AmbiSecure OnePass Card — FIDO2 smart card | AmbiSecure,https://ambisecure.ambimat.com/assets/img/og/featured/ambisecure-products-onepass-card-1200x630.png,ambisecure-products-onepass-card-1200x630.png,1200,630,AmbiSecure OnePass Card combining a corporate badge with contactless FIDO2 authentication over a WebAuthn trust path.,page-specific
https://ambisecure.ambimat.com/products/onepass-platform/,"OnePass Platform — AmbiSecure | Hardware-backed identity, end to end",https://ambisecure.ambimat.com/assets/img/og/featured/ambisecure-products-onepass-platform-1200x630.png,ambisecure-products-onepass-platform-1200x630.png,1200,630,"AmbiSecure OnePass — one identity, every form factor. shown as hardware with card · bio card · usb key, keys held in the secure element.",page-specific
https://ambisecure.ambimat.com/products/onepass-usb-key/,OnePass USB Key &mdash; FIDO2 hardware security key,https://ambisecure.ambimat.com/assets/img/og/featured/ambisecure-products-onepass-usb-key-1200x630.png,ambisecure-products-onepass-usb-key-1200x630.png,1200,630,"AmbiSecure OnePass USB Key providing origin-bound, hardware-backed authentication to a trusted app with no reusable secret.",page-specific
https://ambisecure.ambimat.com/products/piv-bio-card/,AmbiSecure PIV Bio Card &mdash; PIV with on-card fingerprint match,https://ambisecure.ambimat.com/assets/img/og/featured/ambisecure-products-piv-bio-card-1200x630.png,ambisecure-products-piv-bio-card-1200x630.png,1200,630,"AmbiSecure AmbiSecure PIV Bio Card. shown as hardware with id-1 · on-card fingerprint, keys held in the secure element.",page-specific
https://ambisecure.ambimat.com/products/piv-card/,PIV Smart Card — contact + contactless ID-1 | AmbiSecure,https://ambisecure.ambimat.com/assets/img/og/featured/ambisecure-products-piv-card-1200x630.png,ambisecure-products-piv-card-1200x630.png,1200,630,"AmbiSecure AmbiSecure PIV Smart Card. shown as hardware with id-1 · contact + contactless, keys held in the secure element.",page-specific
https://ambisecure.ambimat.com/products/piv-nano-sim-applet/,PIV Nano-Card Applet — secure-element PIV | AmbiSecure,https://ambisecure.ambimat.com/assets/img/og/featured/ambisecure-products-piv-nano-sim-applet-1200x630.png,ambisecure-products-piv-nano-sim-applet-1200x630.png,1200,630,"AmbiSecure AmbiSecure PIV Nano-Card Applet shown as hardware with 4ff nano-card · mff2 module, keys held in the secure element.",page-specific
https://ambisecure.ambimat.com/products/piv-usb-key/,AmbiSecure PIV USB Key &mdash; PIV applet in a USB-A / USB-C key,https://ambisecure.ambimat.com/assets/img/og/featured/ambisecure-products-piv-usb-key-1200x630.png,ambisecure-products-piv-usb-key-1200x630.png,1200,630,"AmbiSecure AmbiSecure PIV USB Key. shown as hardware with usb-a / usb-c · ccid + fido2, keys held in the secure element.",page-specific
https://ambisecure.ambimat.com/products/pkcs-signature-suite/,AmbiSecure PKCS Signature Suite &mdash; Token + Middleware,https://ambisecure.ambimat.com/assets/img/og/pkcs-signature-suite.png,pkcs-signature-suite.png,1200,630,"AmbiSecure title card for the PKCS Signature Suite: a hardware token plus cross-platform middleware for Acrobat, Office, Mozilla, OpenSC and BaseCSP.",page-specific
https://ambisecure.ambimat.com/products/secure-mail-suite/,AmbiSecure Secure Mail Suite &mdash; Email + Document Signing,https://ambisecure.ambimat.com/assets/img/og/secure-mail-suite.png,secure-mail-suite.png,1200,630,"AmbiSecure title card for the Secure Mail Suite: white-label S/MIME email signing and PDF/PKCS#7 document signing, hardware-backed.",page-specific
https://ambisecure.ambimat.com/products/tappable/,AmbiSecure Tappable &mdash; NFC FIDO2 Authenticator | AmbiSecure,https://ambisecure.ambimat.com/assets/img/og/featured/ambisecure-products-tappable-1200x630.png,ambisecure-products-tappable-1200x630.png,1200,630,"AmbiSecure AmbiSecure Tappable shown as hardware with card, keyfob, sticker · nfc, keys held in the secure element.",page-specific
https://ambisecure.ambimat.com/references/aaguids/,FIDO AAGUIDs Reference — AmbiSecure | Curated authenticator directory,https://ambisecure.ambimat.com/assets/img/og/featured/ambisecure-references-aaguids-1200x630.png,ambisecure-references-aaguids-1200x630.png,1200,630,"AAGUID directory resolving a 128-bit FIDO2 identifier into vendor, model and transports, letting AmbiSecure readers map attestation data to real devices.",page-specific
https://ambisecure.ambimat.com/references/apdu-status/,"APDU Status Words — ISO 7816, GP, EMV, FIDO | AmbiSecure",https://ambisecure.ambimat.com/assets/img/og/featured/ambisecure-references-apdu-status-1200x630.png,ambisecure-references-apdu-status-1200x630.png,1200,630,"SW1/SW2 status-word lookup where one two-byte code resolves against ISO 7816-4, GlobalPlatform, EMV and FIDO U2F meanings in AmbiSecure&#x27;s smart-card reference.",page-specific
https://ambisecure.ambimat.com/references/asn1/,ASN.1 Universal Tags Reference — AmbiSecure | ITU-T X.680,https://ambisecure.ambimat.com/assets/img/og/featured/ambisecure-references-asn1-1200x630.png,ambisecure-references-asn1-1200x630.png,1200,630,"The sixteen ASN.1 universal tags split into primitive and constructed forms, showing the DER encoding floor beneath X.509 and FIDO attestation on AmbiSecure.",page-specific
https://ambisecure.ambimat.com/references/desfire-commands/,DESFire Command Set Reference — EV1/EV2/EV3 — AmbiSecure,https://ambisecure.ambimat.com/assets/img/og/featured/ambisecure-references-desfire-commands-1200x630.png,ambisecure-references-desfire-commands-1200x630.png,1200,630,"DESFire command support matrix across EV1, EV2 and EV3 with one-byte codes and functional classes, for reader and personalisation bring-up on AmbiSecure.",page-specific
https://ambisecure.ambimat.com/references/desfire/,DESFire Status Codes Reference — AmbiSecure,https://ambisecure.ambimat.com/assets/img/og/featured/ambisecure-references-desfire-1200x630.png,ambisecure-references-desfire-1200x630.png,1200,630,DESFire EV1/EV2/EV3 response statuses mapped from one-byte code to constants like OPERATION_OK and PERMISSION_DENIED in the AmbiSecure contactless reference.,page-specific
https://ambisecure.ambimat.com/references/emv-tags/,"EMV Tags Reference — AmbiSecure | Books 3, 4, and Contactless",https://ambisecure.ambimat.com/assets/img/og/featured/ambisecure-references-emv-tags-1200x630.png,ambisecure-references-emv-tags-1200x630.png,1200,630,"Faceted EMV tag catalogue on AmbiSecure narrowing Books 3, 4 and Contactless entries to one category — crypto, DOL, template — for card bring-up work.",page-specific
https://ambisecure.ambimat.com/references/etsi-ts-102-941/,ETSI TS 102 941 V2X Trust &amp; Privacy Management Reference — AmbiSecure,https://ambisecure.ambimat.com/assets/img/og/featured/ambisecure-references-etsi-ts-102-941-1200x630.png,ambisecure-references-etsi-ts-102-941-1200x630.png,1200,630,V2X PKI hierarchy showing the enrolment and authorisation split that stops any single authority linking a signed message to a vehicle.,page-specific
https://ambisecure.ambimat.com/references/etsi-ts-103-097/,ETSI TS 103 097 V2X Secured-Message Reference — AmbiSecure,https://ambisecure.ambimat.com/assets/img/og/featured/ambisecure-references-etsi-ts-103-097-1200x630.png,ambisecure-references-etsi-ts-103-097-1200x630.png,1200,630,ETSI ITS-G5 secured-message envelope showing how signed V2X frames alternate between a certificate digest and a full inline certificate.,page-specific
https://ambisecure.ambimat.com/references/globalplatform/,GlobalPlatform Status Words Reference — AmbiSecure | GP 2.3.1,https://ambisecure.ambimat.com/assets/img/og/featured/ambisecure-references-globalplatform-1200x630.png,ambisecure-references-globalplatform-1200x630.png,1200,630,"GlobalPlatform 2.3.1 card-management commands mapped to the status words they return, including 6A84 and 9485, in the AmbiSecure JavaCard engineering reference.",page-specific
https://ambisecure.ambimat.com/references/ieee-1609-2/,IEEE 1609.2 V2X Certificate Reference | AmbiSecure,https://ambisecure.ambimat.com/assets/img/og/featured/ambisecure-references-ieee-1609-2-1200x630.png,ambisecure-references-ieee-1609-2-1200x630.png,1200,630,"AmbiSecure comparison of a compact COER-encoded V2X certificate against a DER X.509 certificate, contrasting size and issuer identification.",page-specific
https://ambisecure.ambimat.com/references/,"Engineering References — smart-card, FIDO, V2X PKI | AmbiSecure",https://ambisecure.ambimat.com/assets/img/og/featured/ambisecure-references-1200x630.png,ambisecure-references-1200x630.png,1200,630,"AmbiSecure engineering reference library shown as a catalogue board of smart-card, FIDO, PKI-encoding and V2X lookup tables, all searched inside the browser.",page-specific
https://ambisecure.ambimat.com/references/iso-21177/,ISO 21177 ITS Station Security Services Reference — AmbiSecure,https://ambisecure.ambimat.com/assets/img/og/featured/ambisecure-references-iso-21177-1200x630.png,ambisecure-references-iso-21177-1200x630.png,1200,630,"Mutual-authentication handshake between two ITS stations, deriving session keys inside an AmbiSecure secure element from 1609.2 certificates.",page-specific
https://ambisecure.ambimat.com/references/iso7816/,ISO/IEC 7816 CLA Values Reference — AmbiSecure,https://ambisecure.ambimat.com/assets/img/og/featured/ambisecure-references-iso7816-1200x630.png,ambisecure-references-iso7816-1200x630.png,1200,630,"ISO/IEC 7816-4 CLA byte expanded into its bit-field, mapping 00, 0C, 80 and 84 to channel, secure-messaging and chaining meaning in AmbiSecure&#x27;s APDU reference.",page-specific
https://ambisecure.ambimat.com/references/javacard-cap/,JavaCard CAP Components Reference — AmbiSecure | JCVM 3.x,https://ambisecure.ambimat.com/assets/img/og/featured/ambisecure-references-javacard-cap-1200x630.png,ambisecure-references-javacard-cap-1200x630.png,1200,630,"Layout of a JavaCard CAP file&#x27;s 12 components, showing which ones the on-card verifier requires and which are stripped before production.",page-specific
https://ambisecure.ambimat.com/references/nfc/,NFC NDEF TNF Types Reference — AmbiSecure,https://ambisecure.ambimat.com/assets/img/og/featured/ambisecure-references-nfc-1200x630.png,ambisecure-references-nfc-1200x630.png,1200,630,"All eight NDEF Type Name Format values from 0x00 to 0x07 shown as a complete three-bit enumeration, with well-known, MIME and external types, on AmbiSecure.",page-specific
https://ambisecure.ambimat.com/references/sgp-32/,GSMA SGP.32 IoT eSIM Reference | AmbiSecure,https://ambisecure.ambimat.com/assets/img/og/featured/ambisecure-references-sgp-32-1200x630.png,ambisecure-references-sgp-32-1200x630.png,1200,630,GSMA SGP.32 entities delivering an encrypted eSIM profile to a headless IoT device&#x27;s eUICC without any user-driven activation step.,page-specific
https://ambisecure.ambimat.com/references/webauthn-cose/,WebAuthn COSE Algorithms Reference — AmbiSecure | RFC 8152,https://ambisecure.ambimat.com/assets/img/og/featured/ambisecure-references-webauthn-cose-1200x630.png,ambisecure-references-webauthn-cose-1200x630.png,1200,630,"COSE algorithm identifiers plotted on a signed axis — ES256 at -7, EdDSA at -8, deprecated RS1 at -65535 — in AmbiSecure&#x27;s WebAuthn and FIDO2 reference.",page-specific
https://ambisecure.ambimat.com/references/x509-extensions/,X.509 Extensions Reference — AmbiSecure,https://ambisecure.ambimat.com/assets/img/og/featured/ambisecure-references-x509-extensions-1200x630.png,ambisecure-references-x509-extensions-1200x630.png,1200,630,"AmbiSecure reference rail of X.509 v3 extension OIDs, flagging which extensions a path validator must treat as critical.",page-specific
https://ambisecure.ambimat.com/references/x509-oids/,X.509 / Certificate OIDs Reference — AmbiSecure,https://ambisecure.ambimat.com/assets/img/og/featured/ambisecure-references-x509-oids-1200x630.png,ambisecure-references-x509-oids-1200x630.png,1200,630,"X.509 OID arcs branching into resolved names — RDN types, v3 extensions, signature algorithms and the FIDO AAGUID extension — in AmbiSecure&#x27;s PKI reference.",page-specific
https://ambisecure.ambimat.com/resources/ambisecure-deck/,AmbiSecure deck &mdash; hardware-rooted trust platform (slideshow) | AmbiSecure,https://ambisecure.ambimat.com/assets/img/og/featured/ambisecure-resources-ambisecure-deck-1200x630.png,ambisecure-resources-ambisecure-deck-1200x630.png,1200,630,"Layered AmbiSecure platform stack — EAL6+ secure element, AmbiSEC module, JavaCard applets, OnePass authenticators — behind a downloadable 20-slide deck.",page-specific
https://ambisecure.ambimat.com/resources/,"Engineering Resources — parsers, references, tools | AmbiSecure",https://ambisecure.ambimat.com/assets/img/og/featured/ambisecure-resources-1200x630.png,ambisecure-resources-1200x630.png,1200,630,AmbiSecure engineering tools previewing ATR parsing and APDU/TLV decoding for secure-element and smart-card work.,page-specific
https://ambisecure.ambimat.com/resources/timelines/epassport/,ePassport evolution timeline &mdash; AmbiSecure resources,https://ambisecure.ambimat.com/assets/img/og/featured/ambisecure-resources-timelines-epassport-1200x630.png,ambisecure-resources-timelines-epassport-1200x630.png,1200,630,"The ePassport chip-to-reader channel hardening from optical MRZ through BAC and PACE to ICAO Digital Travel Credentials, with PKD-distributed trust anchors.",page-specific
https://ambisecure.ambimat.com/resources/timelines/fido/,FIDO evolution timeline &mdash; AmbiSecure resources,https://ambisecure.ambimat.com/assets/img/og/featured/ambisecure-resources-timelines-fido-1200x630.png,ambisecure-resources-timelines-fido-1200x630.png,1200,630,Milestone markers running from the 2012 FIDO Alliance and U2F keys through FIDO2 and CTAP2 to multi-device passkeys and per-credential provenance policy.,page-specific
https://ambisecure.ambimat.com/resources/timelines/,Standards evolution timelines &mdash; AmbiSecure resources,https://ambisecure.ambimat.com/assets/img/og/featured/ambisecure-resources-timelines-1200x630.png,ambisecure-resources-timelines-1200x630.png,1200,630,"Seven standards lanes — FIDO, PIV, ePassport, OTP, smart cards, WebAuthn, secure elements — converging on hardware-rooted trust in the AmbiSecure index.",page-specific
https://ambisecure.ambimat.com/resources/timelines/otp-sms/,OTP and SMS authentication evolution timeline &mdash; AmbiSecure resources,https://ambisecure.ambimat.com/assets/img/og/featured/ambisecure-resources-timelines-otp-sms-1200x630.png,ambisecure-resources-timelines-otp-sms-1200x630.png,1200,630,"Assurance of shared-secret one-time passwords declining from S/Key and HOTP through SIM-swap and NIST&#x27;s SMS removal, crossed by the rise of FIDO key pairs.",page-specific
https://ambisecure.ambimat.com/resources/timelines/piv/,PIV evolution timeline &mdash; AmbiSecure resources,https://ambisecure.ambimat.com/assets/img/og/featured/ambisecure-resources-timelines-piv-1200x630.png,ambisecure-resources-timelines-piv-1200x630.png,1200,630,"A PIV credential shown across card, USB token, phone and nano-card secure element, its SP 800-73 surface unchanged, in the AmbiSecure standards-evolution set.",page-specific
https://ambisecure.ambimat.com/resources/timelines/secure-elements/,Secure-element evolution timeline &mdash; AmbiSecure resources,https://ambisecure.ambimat.com/assets/img/og/featured/ambisecure-resources-timelines-secure-elements-1200x630.png,ambisecure-resources-timelines-secure-elements-1200x630.png,1200,630,"One tamper-resistant die migrating from GSM SIM to TPM, embedded SE, eUICC and IoT trust chip, holding key custody constant as only the host changes.",page-specific
https://ambisecure.ambimat.com/resources/timelines/smart-cards/,Smart-card evolution timeline &mdash; AmbiSecure resources,https://ambisecure.ambimat.com/assets/img/og/featured/ambisecure-resources-timelines-smart-cards-1200x630.png,ambisecure-resources-timelines-smart-cards-1200x630.png,1200,630,A smart-card die evolving from a Moreno memory cell through ISO/IEC 7816 and JavaCard to a JCVM firewall isolating a dozen AID-selectable credential applets.,page-specific
https://ambisecure.ambimat.com/resources/timelines/webauthn-passkey/,WebAuthn and passkey evolution timeline &mdash; AmbiSecure resources,https://ambisecure.ambimat.com/assets/img/og/featured/ambisecure-resources-timelines-webauthn-passkey-1200x630.png,ambisecure-resources-timelines-webauthn-passkey-1200x630.png,1200,630,"WebAuthn spec levels stacking from the W3C Credential Management API to synced passkeys and hybrid transport, ending in per-credential provenance policy.",page-specific
https://ambisecure.ambimat.com/resources/tools/aaguid-lookup/,AAGUID Lookup — AmbiSecure | FIDO2 authenticator directory,https://ambisecure.ambimat.com/assets/img/og/featured/ambisecure-resources-tools-aaguid-lookup-1200x630.png,ambisecure-resources-tools-aaguid-lookup-1200x630.png,1200,630,"AmbiSecure AAGUID lookup resolving a 16-byte FIDO2 identifier into a vendor and model card, with the FIDO MDS BLOB marked as the production source.",page-specific
https://ambisecure.ambimat.com/resources/tools/apdu-builder/,APDU Builder — AmbiSecure | ISO 7816-4 command APDU constructor,https://ambisecure.ambimat.com/assets/img/og/featured/ambisecure-resources-tools-apdu-builder-1200x630.png,ambisecure-resources-tools-apdu-builder-1200x630.png,1200,630,"AmbiSecure APDU builder assembling CLA, INS, P1, P2 and data into an ISO/IEC 7816-4 SELECT command, with Lc derived automatically and the case detected locally.",page-specific
https://ambisecure.ambimat.com/resources/tools/apdu-parser/,APDU Parser — ISO 7816-4 command &amp; response | AmbiSecure,https://ambisecure.ambimat.com/assets/img/og/featured/ambisecure-resources-tools-apdu-parser-1200x630.png,ambisecure-resources-tools-apdu-parser-1200x630.png,1200,630,"AmbiSecure APDU parser visual splitting a SELECT command into header, AID data and a 9000 or 6A82 status word returned by the card, all parsed in the browser.",page-specific
https://ambisecure.ambimat.com/resources/tools/apdu-script-validator/,APDU Script Validator — AmbiSecure | ISO 7816-4 case 1-4,https://ambisecure.ambimat.com/assets/img/og/featured/ambisecure-resources-tools-apdu-script-validator-1200x630.png,ambisecure-resources-tools-apdu-script-validator-1200x630.png,1200,630,"A multi-line APDU script checked line by line for ISO 7816-4 case shape, with no card, no reader and no execution behind the AmbiSecure verdicts.",page-specific
https://ambisecure.ambimat.com/resources/tools/apdu-status-dict/,APDU Status Dictionary — AmbiSecure | Full SW1/SW2 reference,https://ambisecure.ambimat.com/assets/img/og/featured/ambisecure-resources-tools-apdu-status-dict-1200x630.png,ambisecure-resources-tools-apdu-status-dict-1200x630.png,1200,630,"Filterable status-word reference from AmbiSecure grouping 9XYY successes against 6XYY warnings and errors, with ISO 7816-4, GlobalPlatform, EMV and FIDO sources.",page-specific
https://ambisecure.ambimat.com/resources/tools/ascii-hex/,ASCII ↔ HEX Converter — AmbiSecure | Bidirectional ASCII / HEX,https://ambisecure.ambimat.com/assets/img/og/featured/ambisecure-resources-tools-ascii-hex-1200x630.png,ambisecure-resources-tools-ascii-hex-1200x630.png,1200,630,Character-to-byte ribbon showing A and B resolve to 41 42 — the browser-local ASCII/hex view engineers use when reading APDU logs and NDEF payloads.,page-specific
https://ambisecure.ambimat.com/resources/tools/asn1-parser/,ASN.1 BER/DER Parser — AmbiSecure | Walk any ASN.1 structure,https://ambisecure.ambimat.com/assets/img/og/featured/ambisecure-resources-tools-asn1-parser-1200x630.png,ambisecure-resources-tools-asn1-parser-1200x630.png,1200,630,"AmbiSecure ASN.1 BER/DER parser concept: a PEM block opening into a typed tree of SEQUENCE, INTEGER, OID and OCTET STRING nodes decoded entirely client-side.",page-specific
https://ambisecure.ambimat.com/resources/tools/asn1-tree-explorer/,ASN.1 Tree Explorer — AmbiSecure | DER walker with collapsible nodes,https://ambisecure.ambimat.com/assets/img/og/featured/ambisecure-resources-tools-asn1-tree-explorer-1200x630.png,ambisecure-resources-tools-asn1-tree-explorer-1200x630.png,1200,630,"AmbiSecure ASN.1 explorer walking a DER SEQUENCE into named OIDs id-ecPublicKey and prime256v1, accepting PEM and decoding every node in-browser.",page-specific
https://ambisecure.ambimat.com/resources/tools/atr-parser/,ATR Parser &mdash; decode ISO/IEC 7816-3 Answer-To-Reset,https://ambisecure.ambimat.com/assets/img/og/featured/ambisecure-resources-tools-atr-parser-1200x630.png,ambisecure-resources-tools-atr-parser-1200x630.png,1200,630,"AmbiSecure ATR parser diagram showing a smart card emitting TS, T0, TA1, TD1 and historical bytes at reset, decoded in-browser to reveal protocol and timing.",page-specific
https://ambisecure.ambimat.com/resources/tools/ats-parser/,ATS Parser — AmbiSecure | Decode ISO/IEC 14443-4 Answer-To-Select,https://ambisecure.ambimat.com/assets/img/og/featured/ambisecure-resources-tools-ats-parser-1200x630.png,ambisecure-resources-tools-ats-parser-1200x630.png,1200,630,"ATS parser concept from AmbiSecure decoding TL, T0, TA(1), TB(1) and TC(1) from a contactless card&#x27;s answer to RATS, revealing frame size and timing limits.",page-specific
https://ambisecure.ambimat.com/resources/tools/attestation-decoder/,WebAuthn Attestation Decoder — AmbiSecure,https://ambisecure.ambimat.com/assets/img/og/featured/ambisecure-resources-tools-attestation-decoder-1200x630.png,ambisecure-resources-tools-attestation-decoder-1200x630.png,1200,630,"AmbiSecure attestation decoder splitting a CBOR attestationObject into fmt, attStmt and authData, showing how an AAGUID pins an authenticator&#x27;s make and model.",page-specific
https://ambisecure.ambimat.com/resources/tools/authdata-parser/,authenticatorData Parser — AmbiSecure | WebAuthn,https://ambisecure.ambimat.com/assets/img/og/featured/ambisecure-resources-tools-authdata-parser-1200x630.png,ambisecure-resources-tools-authdata-parser-1200x630.png,1200,630,"Byte-offset ribbon of WebAuthn authenticatorData in the AmbiSecure parser, exploding the flags byte into UP, UV, BE, BS and AT bits beside signCount.",page-specific
https://ambisecure.ambimat.com/resources/tools/base32/,Base32 Encoder and Decoder — AmbiSecure | RFC 4648 &amp; base32hex,https://ambisecure.ambimat.com/assets/img/og/featured/ambisecure-resources-tools-base32-1200x630.png,ambisecure-resources-tools-base32-1200x630.png,1200,630,"An otpauth:// secret expanded to Base32 and split across the A-Z 2-7 rail and the sort-preserving base32hex rail, decoded locally in an AmbiSecure browser tool.",page-specific
https://ambisecure.ambimat.com/resources/tools/base64-cert/,Base64 Certificate Decoder | AmbiSecure,https://ambisecure.ambimat.com/assets/img/og/featured/ambisecure-resources-tools-base64-cert-1200x630.png,ambisecure-resources-tools-base64-cert-1200x630.png,1200,630,"A funnel taking PEM, bare base64 and hex blobs down to normalised DER, then re-armouring with the right label — AmbiSecure&#x27;s local certificate blob decoder.",page-specific
